Title,Pub_Year,author_pub_id,num_citations,citedby_url,cites_id
 White organic light-emitting diodes with fluorescent tube efficiency, 2009,5uiQM3wAAAAJ:u5HHmVD_uO8C,3409,https://scholar.google.com/scholar?oi=bibs&hl=en&cites=6223427128501278035,['6223427128501278035']
 Highly efficient organic devices based on electrically doped transport layers, 2007,5uiQM3wAAAAJ:d1gkVwhDpl0C,1698,https://scholar.google.com/scholar?oi=bibs&hl=en&cites=16385674073566359465,['16385674073566359465']
 Highly conductive PEDOT PSS electrode with optimized solvent and thermal post‐treatment for ITO‐free organic solar cells, 2011,5uiQM3wAAAAJ:kNdYIx-mwKoC,1352,https://scholar.google.com/scholar?oi=bibs&hl=en&cites=1142514599653403322,['1142514599653403322']
 Coherent submillimeter-wave emission from Bloch oscillations in a semiconductor superlattice, 1993,5uiQM3wAAAAJ:u-x6o8ySG0sC,961,https://scholar.google.com/scholar?oi=bibs&hl=en&cites=7484130436768700663,['7484130436768700663']
 Triplet-exciton quenching in organic phosphorescent light-emitting diodes with Ir-based emitters, 2007,5uiQM3wAAAAJ:_FxGoFyzp5QC,767,https://scholar.google.com/scholar?oi=bibs&hl=en&cites=16541366094052179109,['16541366094052179109']
 High-efficiency and low-voltage p‐i‐n electrophosphorescent organic light-emitting diodes with double-emission layers, 2004,5uiQM3wAAAAJ:2osOgNQ5qMEC,755,https://scholar.google.com/scholar?oi=bibs&hl=en&cites=3268263796026571421,['3268263796026571421']
 Efficiency roll‐off in organic light‐emitting diodes, 2013,5uiQM3wAAAAJ:nPTYJWkExTIC,736,https://scholar.google.com/scholar?oi=bibs&hl=en&cites=4760718962671460355,['4760718962671460355']
 Optical investigation of Bloch oscillations in a semiconductor superlattice, 1992,5uiQM3wAAAAJ:9yKSN-GCB0IC,705,https://scholar.google.com/scholar?oi=bibs&hl=en&cites=2640592188010467776,['2640592188010467776']
 Low voltage organic light emitting diodes featuring doped phthalocyanine as hole transport material, 1998,5uiQM3wAAAAJ:IjCSPb-OGe4C,656,https://scholar.google.com/scholar?oi=bibs&hl=en&cites=4803661595810138815,['4803661595810138815']
 White organic light-emitting diodes Status and perspective, 2013,5uiQM3wAAAAJ:SGW5VrABaM0C,572,https://scholar.google.com/scholar?oi=bibs&hl=en&cites=1908612124042289196,['1908612124042289196']
 Coherent submillimeter-wave emission from charge oscillations in a double-well potential, 1992,5uiQM3wAAAAJ:qjMakFHDy7sC,552,https://scholar.google.com/scholar?oi=bibs&hl=en&cites=6551468441182600592,['6551468441182600592']
 Doped organic semiconductors Physics and application in light emitting diodes, 2003,5uiQM3wAAAAJ:ufrVoPGSRksC,539,https://scholar.google.com/scholar?oi=bibs&hl=en&cites=1576506574321338489,['1576506574321338489']
 Doping of organic semiconductors, 2013,5uiQM3wAAAAJ:epqYDVWIO7EC,515,https://scholar.google.com/scholar?oi=bibs&hl=en&cites=6022510967099905719,['6022510967099905719']
 Femtosecond energy relaxation in π-conjugated polymers, 1993,5uiQM3wAAAAJ:UeHWp8X0CEIC,513,https://scholar.google.com/scholar?oi=bibs&hl=en&cites=18230689927080354431,['18230689927080354431']
 Low-voltage organic electroluminescent devices using pin structures, 2002,5uiQM3wAAAAJ:zYLM7Y9cAGgC,480,https://scholar.google.com/scholar?oi=bibs&hl=en&cites=15713365041094901424,['15713365041094901424']
 Organic p-i-n solar cells, 2004,5uiQM3wAAAAJ:WF5omc3nYNoC,465,https://scholar.google.com/scholar?oi=bibs&hl=en&cites=44744723475103898,['44744723475103898']
 Triplet harvesting in hybrid white organic Light‐Emitting diodes, 2009,5uiQM3wAAAAJ:qUcmZB5y_30C,462,https://scholar.google.com/scholar?oi=bibs&hl=en&cites=9922395501907565296,['9922395501907565296']
 Degradation mechanisms and reactions in organic light-emitting devices, 2015,5uiQM3wAAAAJ:09LM3QYkMKUC,447,https://scholar.google.com/scholar?oi=bibs&hl=en&cites=1832227632377594514,['1832227632377594514']
 Harvesting triplet excitons from fluorescent blue emitters in white organic light‐emitting diodes, 2007,5uiQM3wAAAAJ:8k81kl-MbHgC,443,https://scholar.google.com/scholar?oi=bibs&hl=en&cites=10614920425648559261,['10614920425648559261']
 Very-low-operating-voltage organic light-emitting diodes using a  amorphous hole injection layer, 2001,5uiQM3wAAAAJ:Tyk-4Ss8FVUC,430,https://scholar.google.com/scholar?oi=bibs&hl=en&cites=730175319240487787,['730175319240487787']
 Controlled doping of phthalocyanine layers by cosublimation with acceptor molecules A systematic Seebeck and conductivity study, 1998,5uiQM3wAAAAJ:eQOLeE2rZwMC,423,https://scholar.google.com/scholar?oi=bibs&hl=en&cites=5301574179795522559,['5301574179795522559']
 Observation of Bloch oscillations in a semiconductor superlattice, 1992,5uiQM3wAAAAJ:W7OEmFMy1HYC,406,https://scholar.google.com/scholar?oi=bibs&hl=en&cites=1885177799615613879,['1885177799615613879']
 Coherent oscillations of a wave packet in a semiconductor double-quantum-well structure, 1991,5uiQM3wAAAAJ:Y0pCki6q_DkC,395,https://scholar.google.com/scholar?oi=bibs&hl=en&cites=7129484098164902417,['7129484098164902417']
 Efficient Vacuum‐Deposited Organic Solar Cells Based on a New Low‐Bandgap Oligothiophene and Fullerene C60, 2006,5uiQM3wAAAAJ:hqOjcs7Dif8C,387,https://scholar.google.com/scholar?oi=bibs&hl=en&cites=501723481797458849,['501723481797458849']
 Doped organic transistors, 2016,5uiQM3wAAAAJ:w9ZB08sdvuUC,383,https://scholar.google.com/scholar?oi=bibs&hl=en&cites=5717812047167115120,['5717812047167115120']
 Interface electronic structure of organic semiconductors with controlled doping levels, 2001,5uiQM3wAAAAJ:LkGwnXOMwfcC,365,https://scholar.google.com/scholar?oi=bibs&hl=en&cites=4871357401236928211,['4871357401236928211']
 Small-molecule solar cells—status and perspectives, 2008,5uiQM3wAAAAJ:3fE2CSJIrl8C,352,https://scholar.google.com/scholar?oi=bibs&hl=en&cites=9434932419544287222,['9434932419544287222']
 Quantification of energy loss mechanisms in organic light-emitting diodes, 2010,5uiQM3wAAAAJ:ldfaerwXgEUC,339,https://scholar.google.com/scholar?oi=bibs&hl=en&cites=4687148977029923053,['4687148977029923053']
 Effects of coherent polarization interactions on time-resolved degenerate four-wave mixing, 1990,5uiQM3wAAAAJ:YsMSGLbcyi4C,338,https://scholar.google.com/scholar?oi=bibs&hl=en&cites=13948856197645502470,['13948856197645502470']
 Influence of Hole‐Transport Layers and Donor Materials on Open‐Circuit Voltage and Shape of I–V Curves of Organic Solar Cells, 2011,5uiQM3wAAAAJ:iH-uZ7U-co4C,334,https://scholar.google.com/scholar?oi=bibs&hl=en&cites=3171904968461061267,['3171904968461061267']
 Electrophosphorescent p–i–n Organic Light‐Emitting Devices for Very‐High‐Efficiency Flat‐Panel Displays, 2002,5uiQM3wAAAAJ:Se3iqnhoufwC,327,https://scholar.google.com/scholar?oi=bibs&hl=en&cites=12136500639560749337,['12136500639560749337']
 Controlled p-type doping of polycrystalline and amorphous organic layers Self-consistent description of conductivity and field-effect mobility by a microscopic percolation model, 2001,5uiQM3wAAAAJ:5nxA0vEk-isC,312,https://scholar.google.com/scholar?oi=bibs&hl=en&cites=17948323249644157459,['17948323249644157459']
 Correlation of π-conjugated oligomer structure with film morphology and organic solar cell performance, 2012,5uiQM3wAAAAJ:CHSYGLWDkRkC,303,https://scholar.google.com/scholar?oi=bibs&hl=en&cites=2750156913169092469,['2750156913169092469']
 Efficient organic tandem solar cells based on small molecules, 2011,5uiQM3wAAAAJ:_Qo2XoVZTnwC,296,https://scholar.google.com/scholar?oi=bibs&hl=en&cites=3597909090447287989,['3597909090447287989']
 The lowest energy Frenkel and charge-transfer excitons in quasi-one-dimensional structures application to MePTCDI and PTCDA crystals, 2000,5uiQM3wAAAAJ:MXK_kJrjxJIC,289,https://scholar.google.com/scholar?oi=bibs&hl=en&cites=2471594770587876592,['2471594770587876592']
 Dicyanovinyl–Substituted Oligothiophenes Structure‐Property Relationships and Application in Vacuum‐Processed Small Molecule Organic Solar Cells, 2011,5uiQM3wAAAAJ:hC7cP41nSMkC,282,https://scholar.google.com/scholar?oi=bibs&hl=en&cites=7979898233839266603,['7979898233839266603']
 Bulk-heterojunction photovoltaic devices based on donor–acceptor organic small molecule blends, 2003,5uiQM3wAAAAJ:0EnyYjriUFMC,275,https://scholar.google.com/scholar?oi=bibs&hl=en&cites=14033464199781714666,['14033464199781714666']
 Ultrastable and efficient red organic light emitting diodes with doped transport layers, 2006,5uiQM3wAAAAJ:qxL8FJ1GzNcC,271,https://scholar.google.com/scholar?oi=bibs&hl=en&cites=16062355261688687671,['16062355261688687671']
 Efficient organic solar cells based on a double  architecture using doped wide-gap transport layers, 2005,5uiQM3wAAAAJ:KlAtU1dfN6UC,269,https://scholar.google.com/scholar?oi=bibs&hl=en&cites=8810566781191754322,['8810566781191754322']
 Imbalanced mobilities causing S-shaped IV curves in planar heterojunction organic solar cells, 2011,5uiQM3wAAAAJ:2P1L_qKh6hAC,268,https://scholar.google.com/scholar?oi=bibs&hl=en&cites=4421272106627246426,['4421272106627246426']
 Strong blue and violet photoluminescence and electroluminescence from germanium-implanted and silicon-implanted silicon-dioxide layers, 1997,5uiQM3wAAAAJ:roLk4NBRz8UC,268,https://scholar.google.com/scholar?oi=bibs&hl=en&cites=17263802819719985775,['17263802819719985775']
 Controlled n-type doping of a molecular organic semiconductor Naphthalenetetracarboxylic dianhydride (NTCDA) doped with bis(ethylenedithio)-tetrathiafulvalene …, 2000,5uiQM3wAAAAJ:YOwf2qJgpHMC,266,https://scholar.google.com/scholar?oi=bibs&hl=en&cites=11886012156958284260,['11886012156958284260']
 Highly efficient white organic light emitting diodes comprising an interlayer to separate fluorescent and phosphorescent regions, 2006,5uiQM3wAAAAJ:aqlVkmm33-oC,262,https://scholar.google.com/scholar?oi=bibs&hl=en&cites=6799284834246107091,['6799284834246107091']
 Efficiency and rate of spontaneous emission in organic electroluminescent devices, 2012,5uiQM3wAAAAJ:J-pR_7NvFogC,259,https://scholar.google.com/scholar?oi=bibs&hl=en&cites=7964352627538855005,['7964352627538855005']
 Color in the corners ITO‐free white OLEDs with angular color stability, 2013,5uiQM3wAAAAJ:F2UWTTQJPOcC,258,https://scholar.google.com/scholar?oi=bibs&hl=en&cites=16499655617006096934,['16499655617006096934']
 Influence of charge balance and exciton distribution on efficiency and lifetime of phosphorescent organic light-emitting devices, 2008,5uiQM3wAAAAJ:HDshCWvjkbEC,257,https://scholar.google.com/scholar?oi=bibs&hl=en&cites=13695533910572586746,['13695533910572586746']
 Quantum beats of excitons in quantum wells, 1990,5uiQM3wAAAAJ:UebtZRa9Y70C,257,"https://scholar.google.com/scholar?oi=bibs&hl=en&cites=18404636643795010403,323557326630046444","['18404636643795010403', '323557326630046444']"
 Organic homojunction diodes with a high built-in potential Interpretation of the current-voltage characteristics by a generalized Einstein relation, 2005,5uiQM3wAAAAJ:Wp0gIr-vW9MC,254,https://scholar.google.com/scholar?oi=bibs&hl=en&cites=6754940705002392659,['6754940705002392659']
 Enhanced hole injection into amorphous hole‐transport layers of organic light‐emitting diodes using controlled p‐type doping, 2001,5uiQM3wAAAAJ:4DMP91E08xMC,252,https://scholar.google.com/scholar?oi=bibs&hl=en&cites=3092668347425927002,['3092668347425927002']
 Very high-efficiency and low voltage phosphorescent organic light-emitting diodes based on a p-i-n junction, 2004,5uiQM3wAAAAJ:M3ejUd6NZC8C,239,https://scholar.google.com/scholar?oi=bibs&hl=en&cites=12479298118514007688,['12479298118514007688']
 Highly conductive polymer anodes as replacements for inorganic materials in high‐efficiency organic light‐emitting diodes, 2007,5uiQM3wAAAAJ:e5wmG9Sq2KIC,222,https://scholar.google.com/scholar?oi=bibs&hl=en&cites=11737547457290326119,['11737547457290326119']
 Low-voltage inverted transparent vacuum deposited organic light-emitting diodes using electrical doping, 2002,5uiQM3wAAAAJ:_kc_bZDykSQC,218,https://scholar.google.com/scholar?oi=bibs&hl=en&cites=14862723251292958959,['14862723251292958959']
 High-efficiency electrophosphorescent organic light-emitting diodes with double light-emitting layers, 2002,5uiQM3wAAAAJ:4TOpqqG69KYC,214,https://scholar.google.com/scholar?oi=bibs&hl=en&cites=1692017560960507221,['1692017560960507221']
 Improvement of transparent metal top electrodes for organic solar cells by introducing a high surface energy seed layer, 2013,5uiQM3wAAAAJ:ZzlSgRqYykMC,208,https://scholar.google.com/scholar?oi=bibs&hl=en&cites=8030406740406737046,['8030406740406737046']
 Pyronin B as a donor for n-type doping of organic thin films, 2003,5uiQM3wAAAAJ:QIV2ME_5wuYC,206,https://scholar.google.com/scholar?oi=bibs&hl=en&cites=4248980270318399159,['4248980270318399159']
 Organic thin‐film photovoltaic cells based on oligothiophenes with reduced bandgap, 2007,5uiQM3wAAAAJ:mB3voiENLucC,204,https://scholar.google.com/scholar?oi=bibs&hl=en&cites=3532526659706881793,['3532526659706881793']
 Direct measurement of the spatial displacement of Bloch-oscillating electrons in semiconductor superlattices, 1997,5uiQM3wAAAAJ:Zph67rFs4hoC,203,https://scholar.google.com/scholar?oi=bibs&hl=en&cites=11075809399936007193,['11075809399936007193']
" Optimum mobility, contact properties, and open-circuit voltage of organic solar cells A drift-diffusion simulation study", 2012,5uiQM3wAAAAJ:_Re3VWB3Y0AC,199,https://scholar.google.com/scholar?oi=bibs&hl=en&cites=11880079567154513483,['11880079567154513483']
 Band structure engineering in organic semiconductors, 2016,5uiQM3wAAAAJ:654Jc7Ppz2kC,195,https://scholar.google.com/scholar?oi=bibs&hl=en&cites=3872606629705977256,['3872606629705977256']
 Efficiency enhancement of organic solar cells by fabricating periodic surface textures using direct laser interference patterning, 2012,5uiQM3wAAAAJ:N5tVd3kTz84C,191,https://scholar.google.com/scholar?oi=bibs&hl=en&cites=4583982926506969898,['4583982926506969898']
 Top-emitting organic light-emitting diodes, 2011,5uiQM3wAAAAJ:HE397vMXCloC,184,https://scholar.google.com/scholar?oi=bibs&hl=en&cites=10534502771875274216,['10534502771875274216']
 Impact of mesoscale order on open-circuit voltage in organic solar cells, 2015,5uiQM3wAAAAJ:QAOzB4mb83kC,183,https://scholar.google.com/scholar?oi=bibs&hl=en&cites=10794155830040418901,['10794155830040418901']
 Quantum beats of light hole and heavy hole excitons in quantum wells, 1990,5uiQM3wAAAAJ:ULOm3_A8WrAC,182,https://scholar.google.com/scholar?oi=bibs&hl=en&cites=6999320140233295360,['6999320140233295360']
 Hot-carrier energy-loss rates in GaAs/Al x Ga 1− x As quantum wells, 1988,5uiQM3wAAAAJ:9ZlFYXVOiuMC,182,https://scholar.google.com/scholar?oi=bibs&hl=en&cites=17401852770084324266,['17401852770084324266']
 Doped organic transistors operating in the inversion and depletion regime, 2013,5uiQM3wAAAAJ:rTD5ala9j4wC,179,https://scholar.google.com/scholar?oi=bibs&hl=en&cites=2958924880431960013,['2958924880431960013']
 Fermi level shift and doping efficiency in p-doped small molecule organic semiconductors a photoelectron spectroscopy and theoretical study, 2012,5uiQM3wAAAAJ:Ug5p-4gJ2f0C,178,https://scholar.google.com/scholar?oi=bibs&hl=en&cites=17098488308958651076,['17098488308958651076']
 Increased open‐circuit voltage of organic solar cells by reduced donor‐acceptor interface area, 2014,5uiQM3wAAAAJ:rzmi0EmCOGEC,177,https://scholar.google.com/scholar?oi=bibs&hl=en&cites=3330361601098260282,['3330361601098260282']
 Water and oxygen induced degradation of small molecule organic solar cells, 2011,5uiQM3wAAAAJ:eJXPG6dFmWUC,173,https://scholar.google.com/scholar?oi=bibs&hl=en&cites=13679967569956380818,['13679967569956380818']
 Origin of open circuit voltage in planar and bulk heterojunction organic thin-film photovoltaics depending on doped transport layers, 2008,5uiQM3wAAAAJ:bEWYMUwI8FkC,172,https://scholar.google.com/scholar?oi=bibs&hl=en&cites=15606090017969551488,['15606090017969551488']
 Hole-transport material variation in fully vacuum deposited perovskite solar cells, 2014,5uiQM3wAAAAJ:U3qCfcK-7lkC,169,https://scholar.google.com/scholar?oi=bibs&hl=en&cites=5985139799496784759,['5985139799496784759']
 Synthesis and characterization of near‐infrared absorbing benzannulated aza‐BODIPY dyes, 2011,5uiQM3wAAAAJ:dshw04ExmUIC,164,https://scholar.google.com/scholar?oi=bibs&hl=en&cites=14815318023937306857,['14815318023937306857']
 Optimized efficiency and angular emission characteristics of white top-emitting organic electroluminescent diodes, 2009,5uiQM3wAAAAJ:k_IJM867U9cC,161,https://scholar.google.com/scholar?oi=bibs&hl=en&cites=7849372087721138981,['7849372087721138981']
 Molecular-scale simulation of electroluminescence in a multilayer white organic light-emitting diode, 2013,5uiQM3wAAAAJ:WC23djZS0W4C,160,https://scholar.google.com/scholar?oi=bibs&hl=en&cites=2941643797168002280,['2941643797168002280']
 Reduced efficiency roll-off in high-efficiency hybrid white organic light-emitting diodes, 2008,5uiQM3wAAAAJ:RHpTSmoSYBkC,160,https://scholar.google.com/scholar?oi=bibs&hl=en&cites=6218421478712456595,['6218421478712456595']
" 2-(2-Methoxyphenyl)-1,3-dimethyl-1H-benzoimidazol-3-ium Iodide as a New Air-Stable n-Type Dopant for Vacuum-Processed Organic Semiconductor Thin Films", 2012,5uiQM3wAAAAJ:t7zJ5fGR-2UC,159,https://scholar.google.com/scholar?oi=bibs&hl=en&cites=14156756304374531131,['14156756304374531131']
 An inter-laboratory stability study of roll-to-roll coated flexible polymer solar modules, 2011,5uiQM3wAAAAJ:TFP_iSt0sucC,159,https://scholar.google.com/scholar?oi=bibs&hl=en&cites=852800352324518290,['852800352324518290']
 Controlled p-doping of pigment layers by cosublimation Basic mechanisms and implications for their use in organic photovoltaic cells, 2000,5uiQM3wAAAAJ:dhFuZR0502QC,157,https://scholar.google.com/scholar?oi=bibs&hl=en&cites=7920680468396992060,['7920680468396992060']
 Nano-particle based scattering layers for optical efficiency enhancement of organic light-emitting diodes and organic solar cells, 2013,5uiQM3wAAAAJ:lgwcVrK6X84C,156,https://scholar.google.com/scholar?oi=bibs&hl=en&cites=1332250261928133020,['1332250261928133020']
" Epitaxial growth of 3, 4, 9, 10-perylene-tetracarboxylic-dianhydride on Au (111) A STM and RHEED study", 1997,5uiQM3wAAAAJ:ZeXyd9-uunAC,154,https://scholar.google.com/scholar?oi=bibs&hl=en&cites=18129548359083652560,['18129548359083652560']
 Polarization dependence of heavy-and light-hole quantum beats, 1992,5uiQM3wAAAAJ:L8Ckcad2t8MC,154,https://scholar.google.com/scholar?oi=bibs&hl=en&cites=9399270875673140634,['9399270875673140634']
 Single-step triplet-triplet annihilation An intrinsic limit for the high brightness efficiency of phosphorescent organic light emitting diodes, 2007,5uiQM3wAAAAJ:SeFeTyx0c_EC,153,https://scholar.google.com/scholar?oi=bibs&hl=en&cites=2124370382915580485,['2124370382915580485']
 Interrelation between Crystal Packing and Small‐Molecule Organic Solar Cell Performance, 2012,5uiQM3wAAAAJ:l7t_Zn2s7bgC,152,https://scholar.google.com/scholar?oi=bibs&hl=en&cites=1785276828632615929,['1785276828632615929']
 Ultrafast relaxation and exciton–exciton annihilation in PTCDA thin films at high excitation densities, 2006,5uiQM3wAAAAJ:P5F9QuxV20EC,152,https://scholar.google.com/scholar?oi=bibs&hl=en&cites=15560262963442680804,['15560262963442680804']
 Photoelectron spectroscopy study of systematically varied doping concentrations in an organic semiconductor layer using a molecular p-dopant, 2009,5uiQM3wAAAAJ:1qzjygNMrQYC,151,https://scholar.google.com/scholar?oi=bibs&hl=en&cites=17244051379498388107,['17244051379498388107']
 Elementary steps in electrical doping of organic semiconductors, 2018,5uiQM3wAAAAJ:0qX8s2k1IRwC,150,https://scholar.google.com/scholar?oi=bibs&hl=en&cites=758693223653684182,['758693223653684182']
" Room‐temperature, short‐wavelength (400–500 nm) photoluminescence from silicon‐implanted silicon dioxide films", 1996,5uiQM3wAAAAJ:mVmsd5A6BfQC,150,https://scholar.google.com/scholar?oi=bibs&hl=en&cites=7118788976220952708,['7118788976220952708']
 Improved bulk heterojunction organic solar cells employing  fullerenes, 2009,5uiQM3wAAAAJ:70eg2SAEIzsC,149,https://scholar.google.com/scholar?oi=bibs&hl=en&cites=8773470481345749019,['8773470481345749019']
 Subpicosecond four-wave mixing in GaAs/Al x Ga 1− x As quantum wells, 1991,5uiQM3wAAAAJ:7PzlFSSx8tAC,147,"https://scholar.google.com/scholar?oi=bibs&hl=en&cites=4985190011724195987,13455981556247093087","['4985190011724195987', '13455981556247093087']"
 Highly efficient top emitting organic light-emitting diodes with organic outcoupling enhancement layers, 2006,5uiQM3wAAAAJ:R3hNpaxXUhUC,144,https://scholar.google.com/scholar?oi=bibs&hl=en&cites=2632467687537552685,['2632467687537552685']
 Leuco crystal violet as a dopant for n-doping of organic thin films of fullerene C60, 2004,5uiQM3wAAAAJ:yD5IFk8b50cC,143,https://scholar.google.com/scholar?oi=bibs&hl=en&cites=11989039050700124737,['11989039050700124737']
 Interband optical investigation of Bloch oscillations in semiconductor superlattices, 1998,5uiQM3wAAAAJ:hFOr9nPyWt4C,143,https://scholar.google.com/scholar?oi=bibs&hl=en&cites=17417204321450172660,['17417204321450172660']
 Organic narrowband near-infrared photodetectors based on intermolecular charge-transfer absorption, 2017,5uiQM3wAAAAJ:VHM5RxzNINsC,142,https://scholar.google.com/scholar?oi=bibs&hl=en&cites=7635938630450747475,['7635938630450747475']
 Towards efficient tin-doped indium oxide (ITO)-free inverted organic solar cells using metal cathodes, 2009,5uiQM3wAAAAJ:NMxIlDl6LWMC,142,https://scholar.google.com/scholar?oi=bibs&hl=en&cites=15990925618609921325,['15990925618609921325']
 Reduced efficiency roll-off in phosphorescent organic light emitting diodes by suppression of triplet-triplet annihilation, 2007,5uiQM3wAAAAJ:O3NaXMp0MMsC,142,https://scholar.google.com/scholar?oi=bibs&hl=en&cites=4093151730530490749,['4093151730530490749']
 Highly efficient white top-emitting organic light-emitting diodes comprising laminated microlens films, 2012,5uiQM3wAAAAJ:-_dYPAW6P2MC,141,https://scholar.google.com/scholar?oi=bibs&hl=en&cites=13467547232244709489,['13467547232244709489']
 MIP-type organic solar cells incorporating phthalocyanine/fullerene mixed layers and doped wide-gap transport layers, 2004,5uiQM3wAAAAJ:j3f4tGmQtD8C,141,https://scholar.google.com/scholar?oi=bibs&hl=en&cites=11533658032728464582,['11533658032728464582']
 Efficiency and stability of pin type organic light emitting diodes for display and lighting applications, 2009,5uiQM3wAAAAJ:Tiz5es2fbqcC,139,https://scholar.google.com/scholar?oi=bibs&hl=en&cites=1096293204446184155,['1096293204446184155']
 Organic solar cells on indium tin oxide and aluminum doped zinc oxide anodes, 2007,5uiQM3wAAAAJ:BqipwSGYUEgC,135,https://scholar.google.com/scholar?oi=bibs&hl=en&cites=14411565989052658968,['14411565989052658968']
 In-situ conductivity and Seebeck measurements of highly efficient n-dopants in fullerene C60, 2012,5uiQM3wAAAAJ:9vf0nzSNQJEC,133,https://scholar.google.com/scholar?oi=bibs&hl=en&cites=1706280205170072965,['1706280205170072965']
 Optimizing organic photovoltaics using tailored heterojunctions A photoinduced absorption study of oligothiophenes with low band gaps, 2008,5uiQM3wAAAAJ:maZDTaKrznsC,132,https://scholar.google.com/scholar?oi=bibs&hl=en&cites=14323269417306264946,['14323269417306264946']
 Controlled current matching in small molecule organic tandem solar cells using doped spacer layers, 2010,5uiQM3wAAAAJ:lSLTfruPkqcC,131,https://scholar.google.com/scholar?oi=bibs&hl=en&cites=5456491946258346913,['5456491946258346913']
 Comparing the emissive dipole orientation of two similar phosphorescent green emitter molecules in highly efficient organic light-emitting diodes, 2012,5uiQM3wAAAAJ:7H_MAutzIkAC,130,https://scholar.google.com/scholar?oi=bibs&hl=en&cites=2964741413998280648,['2964741413998280648']
 Achieving high efficiency and improved stability in ITO‐free transparent organic light‐emitting diodes with conductive polymer electrodes, 2013,5uiQM3wAAAAJ:-DxkuPiZhfEC,128,https://scholar.google.com/scholar?oi=bibs&hl=en&cites=13907803477044885325,['13907803477044885325']
 Chemical degradation mechanisms of highly efficient blue phosphorescent emitters used for organic light emitting diodes, 2013,5uiQM3wAAAAJ:jgBuDB5drN8C,128,https://scholar.google.com/scholar?oi=bibs&hl=en&cites=7452135044712750495,['7452135044712750495']
 Spin relaxation and thermalization of excitons in GaAs quantum wells, 1991,5uiQM3wAAAAJ:-f6ydRqryjwC,128,"https://scholar.google.com/scholar?oi=bibs&hl=en&cites=17323304069309966537,2877505597641684443","['17323304069309966537', '2877505597641684443']"
 Dynamics of a high- vertical-cavity organic laser, 2005,5uiQM3wAAAAJ:NaGl4SEjCO4C,127,https://scholar.google.com/scholar?oi=bibs&hl=en&cites=9994217868774205034,['9994217868774205034']
 n‐Type doping of organic thin films using cationic dyes, 2004,5uiQM3wAAAAJ:J_g5lzvAfSwC,127,https://scholar.google.com/scholar?oi=bibs&hl=en&cites=445678221948503655,['445678221948503655']
 Bloch oscillations of excitonic wave packets in semiconductor superlattices, 1994,5uiQM3wAAAAJ:IWHjjKOFINEC,127,https://scholar.google.com/scholar?oi=bibs&hl=en&cites=13027227038092516718,['13027227038092516718']
 Structural phase transition in pentacene caused by molecular doping and its effect on charge carrier mobility, 2012,5uiQM3wAAAAJ:eMMeJKvmdy0C,126,https://scholar.google.com/scholar?oi=bibs&hl=en&cites=10691875404006658079,['10691875404006658079']
" Doped Organic Semiconductors Trap‐Filling, Impurity Saturation, and Reserve Regimes", 2015,5uiQM3wAAAAJ:fF_gHTpLxhAC,124,https://scholar.google.com/scholar?oi=bibs&hl=en&cites=12553173672995672085,['12553173672995672085']
