Title,Pub_Year,author_pub_id,num_citations,citedby_url,cites_id
 A spray-coating process for highly conductive silver nanowire networks as the transparent top-electrode for small molecule organic photovoltaics, 2015,5uiQM3wAAAAJ:dhpJJ7xvgBgC,60,https://scholar.google.com/scholar?oi=bibs&hl=en&cites=17652975158978476804,['17652975158978476804']
 Water ingress into and climate dependent lifetime of organic photovoltaic cells investigated by calcium corrosion tests, 2014,5uiQM3wAAAAJ:AZju0d2GQJ0C,60,https://scholar.google.com/scholar?oi=bibs&hl=en&cites=3824529998655619941,['3824529998655619941']
 Organic solar cells based on a novel infrared absorbing aza-bodipy dye, 2012,5uiQM3wAAAAJ:WJVC3Jt7v1AC,60,https://scholar.google.com/scholar?oi=bibs&hl=en&cites=3708887407569959059,['3708887407569959059']
" Influence of the hole blocking layer on blue phosphorescent organic light-emitting devices using 3, 6-di (9-carbazolyl)-9-(2-ethylhexyl) carbazole as host material", 2010,5uiQM3wAAAAJ:JoZmwDi-zQgC,60,https://scholar.google.com/scholar?oi=bibs&hl=en&cites=9578110129249347645,['9578110129249347645']
 Excitons in quasi-one-dimensional organic crystals, 2002,5uiQM3wAAAAJ:UxriW0iASnsC,60,https://scholar.google.com/scholar?oi=bibs&hl=en&cites=9925653433871407182,['9925653433871407182']
 Singlet exciton diffusion length in organic light-emitting diodes, 2012,5uiQM3wAAAAJ:XvxMoLDsR5gC,59,https://scholar.google.com/scholar?oi=bibs&hl=en&cites=4262970895816681100,['4262970895816681100']
 Lifetime of organic light emitting diodes on polymer anodes, 2008,5uiQM3wAAAAJ:BwyfMAYsbu0C,58,https://scholar.google.com/scholar?oi=bibs&hl=en&cites=7503854485926708592,['7503854485926708592']
 Lifetime of Wannier-Stark states in semiconductor superlattices under strong Zener tunneling to above-barrier bands, 2003,5uiQM3wAAAAJ:XiSMed-E-HIC,58,https://scholar.google.com/scholar?oi=bibs&hl=en&cites=10302326067879991437,['10302326067879991437']
 Optical control of Bloch-oscillation amplitudes From harmonic spatial motion to breathing modes, 1998,5uiQM3wAAAAJ:a0OBvERweLwC,58,https://scholar.google.com/scholar?oi=bibs&hl=en&cites=14823871521439855902,['14823871521439855902']
 Cooling of a hot electron-hole plasma in Al x Ga 1− x As, 1989,5uiQM3wAAAAJ:xtRiw3GOFMkC,58,https://scholar.google.com/scholar?oi=bibs&hl=en&cites=11861169473637392588,['11861169473637392588']
 Feel the heat Nonlinear electrothermal feedback in organic LEDs, 2014,5uiQM3wAAAAJ:hEXC_dOfxuUC,57,https://scholar.google.com/scholar?oi=bibs&hl=en&cites=4975739027188403006,['4975739027188403006']
 Quantifying charge transfer energies at donor–acceptor interfaces in small-molecule solar cells with constrained DFTB and spectroscopic methods, 2013,5uiQM3wAAAAJ:JP7YXuLIOvAC,57,https://scholar.google.com/scholar?oi=bibs&hl=en&cites=1047493544781404671,['1047493544781404671']
" Self-heating, bistability, and thermal switching in organic semiconductors", 2013,5uiQM3wAAAAJ:Dem6FJhTUoYC,57,https://scholar.google.com/scholar?oi=bibs&hl=en&cites=3174589986840838436,['3174589986840838436']
 Dynamics of Bloch oscillations under the influence of scattering and coherent plasmon coupling, 2000,5uiQM3wAAAAJ:1sJd4Hv_s6UC,57,https://scholar.google.com/scholar?oi=bibs&hl=en&cites=589929565955683637,['589929565955683637']
 Highly efficient p-dopants in amorphous hosts, 2014,5uiQM3wAAAAJ:4Yq6kJLCcecC,56,https://scholar.google.com/scholar?oi=bibs&hl=en&cites=4483936919049826141,['4483936919049826141']
 Eliminating micro‐cavity effects in white top‐emitting OLEDs by ultra‐thin metallic top electrodes, 2013,5uiQM3wAAAAJ:AFXcoJnoRH0C,56,https://scholar.google.com/scholar?oi=bibs&hl=en&cites=14364958297592812078,['14364958297592812078']
 An all  vertical transistor for high frequency and high current density applications, 2012,5uiQM3wAAAAJ:FiDNX6EVdGUC,56,https://scholar.google.com/scholar?oi=bibs&hl=en&cites=14795770013604152086,['14795770013604152086']
 Aging of flat heterojunction zinc phthalocyanine/fullerene C60 organic solar cells, 2010,5uiQM3wAAAAJ:Fu2w8maKXqMC,56,https://scholar.google.com/scholar?oi=bibs&hl=en&cites=2999765310386463348,['2999765310386463348']
 Organic light-emitting diodes for lighting High color quality by controlling energy transfer processes in host-guest-systems, 2012,5uiQM3wAAAAJ:MLfJN-KU85MC,55,https://scholar.google.com/scholar?oi=bibs&hl=en&cites=6568417278156207174,['6568417278156207174']
 Outcoupling efficiency in small-molecule OLEDs from theory to experiment, 2010,5uiQM3wAAAAJ:olpn-zPbct0C,55,https://scholar.google.com/scholar?oi=bibs&hl=en&cites=854036420236684617,['854036420236684617']
" Structure of 3, 4, 9, 10-perylene-tetracarboxylic-dianhydride grown on reconstructed and unreconstructed Au (100)", 1999,5uiQM3wAAAAJ:KxtntwgDAa4C,55,https://scholar.google.com/scholar?oi=bibs&hl=en&cites=5244794535043891537,['5244794535043891537']
 Evaluation and control of the orientation of small molecules for strongly absorbing organic thin films, 2013,5uiQM3wAAAAJ:WC9gN4BGCRcC,54,https://scholar.google.com/scholar?oi=bibs&hl=en&cites=5942669163076248468,['5942669163076248468']
" Second‐harmonic generation in Si–SiO2 heterostructures formed by chemical, thermal, and plasma‐assisted oxidation and deposition processes", 1993,5uiQM3wAAAAJ:WbkHhVStYXYC,54,https://scholar.google.com/scholar?oi=bibs&hl=en&cites=9866739482312322711,['9866739482312322711']
 Reduced dimensionality of hot-carrier relaxation in GaAs quantum wells, 1988,5uiQM3wAAAAJ:4OULZ7Gr8RgC,54,https://scholar.google.com/scholar?oi=bibs&hl=en&cites=7288652050101444688,['7288652050101444688']
" Antenna effects and improved efficiency in multiple heterojunction photovoltaic cells based on pentacene, zinc phthalocyanine, and ", 2009,5uiQM3wAAAAJ:kRWSkSYxWN8C,53,https://scholar.google.com/scholar?oi=bibs&hl=en&cites=6353637459421134940,['6353637459421134940']
 Continuously tunable laser emission from a wedge-shaped organic microcavity, 2008,5uiQM3wAAAAJ:35r97b3x0nAC,53,https://scholar.google.com/scholar?oi=bibs&hl=en&cites=1512346961735871502,['1512346961735871502']
 Efficient semitransparent small-molecule organic solar cells, 2009,5uiQM3wAAAAJ:1yQoGdGgb4wC,52,https://scholar.google.com/scholar?oi=bibs&hl=en&cites=14373962339332296103,['14373962339332296103']
 Improved light harvesting in tin-doped indum oxide (ITO)-free inverted bulk-heterojunction organic solar cells using capping layers, 2008,5uiQM3wAAAAJ:V3AGJWp-ZtQC,52,https://scholar.google.com/scholar?oi=bibs&hl=en&cites=9512535148136628342,['9512535148136628342']
 Organic Solar Cells—The Path to Commercial Success, 2021,5uiQM3wAAAAJ:BzPC9jo9PWgC,51,https://scholar.google.com/scholar?oi=bibs&hl=en&cites=4650417575808250914,['4650417575808250914']
 Strategic-tuning of radiative excitons for efficient and stable fluorescent white organic light-emitting diodes, 2019,5uiQM3wAAAAJ:SyxJh60XUSQC,51,https://scholar.google.com/scholar?oi=bibs&hl=en&cites=16656700041844390286,['16656700041844390286']
 Organic thin film photovoltaic cells based on planar and mixed heterojunctions between fullerene and a low bandgap oligothiophene, 2009,5uiQM3wAAAAJ:5awf1xo2G04C,51,https://scholar.google.com/scholar?oi=bibs&hl=en&cites=2237076514615519836,['2237076514615519836']
 Enhanced photogeneration of triplet excitons in an oligothiophene–fullerene blend, 2007,5uiQM3wAAAAJ:AXPGKjj_ei8C,51,https://scholar.google.com/scholar?oi=bibs&hl=en&cites=3216154214637225507,['3216154214637225507']
 Transient absorption spectroscopy and quantum-chemical studies of matrix-isolated perylene derivatives, 2006,5uiQM3wAAAAJ:OU6Ihb5iCvQC,50,https://scholar.google.com/scholar?oi=bibs&hl=en&cites=16919594724336482347,['16919594724336482347']
 High‐Performance Near‐Infrared Phototransistor Based on n‐Type Small‐Molecular Organic Semiconductor, 2017,5uiQM3wAAAAJ:mS4qin7VKjkC,49,https://scholar.google.com/scholar?oi=bibs&hl=en&cites=14500084506371025862,['14500084506371025862']
 Materials Meets Concepts in Molecule‐Based Electronics, 2015,5uiQM3wAAAAJ:IExZWSxeYXUC,49,https://scholar.google.com/scholar?oi=bibs&hl=en&cites=16257384627216158122,['16257384627216158122']
 Parabolic polarization splitting of Tamm states in a metal-organic microcavity, 2012,5uiQM3wAAAAJ:GtLg2Ama23sC,49,https://scholar.google.com/scholar?oi=bibs&hl=en&cites=15392125492547085844,['15392125492547085844']
 Inverted organic light emitting diode with doped layers, 2007,5uiQM3wAAAAJ:5bg8sr1QxYwC,49,https://scholar.google.com/scholar?oi=bibs&hl=en&cites=1150215103941134248,['1150215103941134248']
 Fermi-edge singularity in heavily doped GaAs multiple quantum wells, 1989,5uiQM3wAAAAJ:u9iWguZQMMsC,49,https://scholar.google.com/scholar?oi=bibs&hl=en&cites=8208239820123978113,['8208239820123978113']
 Characterization of tandem organic solar cells, 2015,5uiQM3wAAAAJ:eIKNFFVQvJAC,48,https://scholar.google.com/scholar?oi=bibs&hl=en&cites=8841812309949458714,['8841812309949458714']
 Near-infrared organic light emitting diodes based on heavy metal phthalocyanines, 2008,5uiQM3wAAAAJ:ipzZ9siozwsC,48,https://scholar.google.com/scholar?oi=bibs&hl=en&cites=18011955964223747588,['18011955964223747588']
 Quantum efficiency enhancement in top-emitting organic light-emitting diodes as a result of enhanced intrinsic quantum yield, 2006,5uiQM3wAAAAJ:eq2jaN3J8jMC,48,https://scholar.google.com/scholar?oi=bibs&hl=en&cites=17023156334157934,['17023156334157934']
 Spatial distribution of free‐carrier lifetime and deep‐level luminescence across a semi‐insulating GaAs wafer, 1987,5uiQM3wAAAAJ:D_sINldO8mEC,48,https://scholar.google.com/scholar?oi=bibs&hl=en&cites=2279535681853106204,['2279535681853106204']
 Impact of molecular quadrupole moments on the energy levels at organic heterojunctions, 2019,5uiQM3wAAAAJ:uqZYSrDi9MMC,47,https://scholar.google.com/scholar?oi=bibs&hl=en&cites=2746096698355720557,['2746096698355720557']
" Homoleptic Co (II), Ni (II), Cu (II), Zn (II) and Hg (II) complexes of bis-(phenyl)-diisoindol-aza-methene", 2011,5uiQM3wAAAAJ:F9fV5C73w3QC,47,https://scholar.google.com/scholar?oi=bibs&hl=en&cites=15540131635449133297,['15540131635449133297']
 Field dependence of thermally stimulated currents in , 2001,5uiQM3wAAAAJ:BrmTIyaxlBUC,47,https://scholar.google.com/scholar?oi=bibs&hl=en&cites=13435632882328865730,['13435632882328865730']
 Organic photovoltaics, 2016,5uiQM3wAAAAJ:XUAslYVNQLQC,46,https://scholar.google.com/scholar?oi=bibs&hl=en&cites=13387783391767119611,['13387783391767119611']
 Trap states in ZnPc C60 small-molecule organic solar cells, 2013,5uiQM3wAAAAJ:GFxP56DSvIMC,46,https://scholar.google.com/scholar?oi=bibs&hl=en&cites=7931736516458212075,['7931736516458212075']
 The role of energy level matching in organic solar cells—Hexaazatriphenylene hexacarbonitrile as transparent electron transport material, 2011,5uiQM3wAAAAJ:0N-VGjzr574C,46,https://scholar.google.com/scholar?oi=bibs&hl=en&cites=2766859869257631361,['2766859869257631361']
 Maximal regularity for nonsmooth parabolic problems in Sobolev-Morrey spaces, 2007,5uiQM3wAAAAJ:e9bUPLv0EjcC,46,"https://scholar.google.com/scholar?oi=bibs&hl=en&cites=343817376171862356,13743018959744464248,6635066726668415379","['343817376171862356', '13743018959744464248', '6635066726668415379']"
 Efficient and flexible solution, 2011,5uiQM3wAAAAJ:Ri6SYOTghG4C,45,https://scholar.google.com/scholar?oi=bibs&hl=en&cites=1084782696183004749,['1084782696183004749']
 Quantitative description of charge-carrier transport in a white organic light-emitting diode, 2011,5uiQM3wAAAAJ:tuHXwOkdijsC,45,https://scholar.google.com/scholar?oi=bibs&hl=en&cites=3033759257241817935,['3033759257241817935']
 Improved efficiency and lifetime in small molecule organic solar cells with optimized conductive polymer electrodes, 2011,5uiQM3wAAAAJ:5qfkUJPXOUwC,45,https://scholar.google.com/scholar?oi=bibs&hl=en&cites=4888616833780036957,['4888616833780036957']
 Role of oxygen-bonds in the degradation process of phosphorescent organic light emitting diodes, 2011,5uiQM3wAAAAJ:foquWX3nUaYC,45,https://scholar.google.com/scholar?oi=bibs&hl=en&cites=5011401960779865841,['5011401960779865841']
 Origin of damages in OLED from Al top electrode deposition by DC magnetron sputtering, 2010,5uiQM3wAAAAJ:ClCfbGk0d_YC,45,https://scholar.google.com/scholar?oi=bibs&hl=en&cites=3367586142605197630,['3367586142605197630']
 Self-doping and partial oxidation of metal-on-organic interfaces for organic semiconductor devices studied by chemical analysis techniques, 2008,5uiQM3wAAAAJ:9Nmd_mFXekcC,45,https://scholar.google.com/scholar?oi=bibs&hl=en&cites=1674914785114763577,['1674914785114763577']
 Influence of Cavity Thickness and Emitter Orientation on the Efficiency Roll‐Off of Phosphorescent Organic Light‐Emitting Diodes, 2014,5uiQM3wAAAAJ:yeL6HyUMUGUC,44,https://scholar.google.com/scholar?oi=bibs&hl=en&cites=11812435984419611247,['11812435984419611247']
 Quantitative allocation of Bragg scattering effects in highly efficient OLEDs fabricated on periodically corrugated substrates, 2013,5uiQM3wAAAAJ:isU91gLudPYC,44,https://scholar.google.com/scholar?oi=bibs&hl=en&cites=17641076037957279082,['17641076037957279082']
 Selective absorption enhancement in organic solar cells using light incoupling layers, 2010,5uiQM3wAAAAJ:PR6Y55bgFSsC,44,https://scholar.google.com/scholar?oi=bibs&hl=en&cites=9281220513801346408,['9281220513801346408']
 Dicyanovinyl-quinquethiophenes with varying alkyl chain lengths Investigation of their performance in organic devices, 2008,5uiQM3wAAAAJ:bnK-pcrLprsC,44,https://scholar.google.com/scholar?oi=bibs&hl=en&cites=14494884348430271974,['14494884348430271974']
" Transparent, thermally stable light-emitting component comprising organic layers", 2006,5uiQM3wAAAAJ:tKAzc9rXhukC,44,https://scholar.google.com/scholar?oi=bibs&hl=en&cites=11089991775824351218,['11089991775824351218']
 Scanning tunneling microscope investigations of organic heterostructures prepared by a combination of self-assembly and molecular beam epitaxy, 2000,5uiQM3wAAAAJ:4fKUyHm3Qg0C,44,https://scholar.google.com/scholar?oi=bibs&hl=en&cites=13608955327604069790,['13608955327604069790']
 Dissipative dynamics of an electronic wavepacket in a semiconductor double well potential, 1992,5uiQM3wAAAAJ:B3FOqHPlNUQC,44,https://scholar.google.com/scholar?oi=bibs&hl=en&cites=15411837351586688693,['15411837351586688693']
 Determination of optical constants of thin absorbing films from normal incidence reflectance and transmittance measurements, 1999,5uiQM3wAAAAJ:5ugPr518TE4C,43,https://scholar.google.com/scholar?oi=bibs&hl=en&cites=10355410964871897426,['10355410964871897426']
 Exciton absorption saturation by phase-space filling influence of carrier temperature and density, 1994,5uiQM3wAAAAJ:BUYA1_V_uYcC,43,https://scholar.google.com/scholar?oi=bibs&hl=en&cites=16203361472192383530,['16203361472192383530']
 Efficient flexible organic photovoltaics using silver nanowires and polymer based transparent electrodes, 2016,5uiQM3wAAAAJ:Y0RG-0fxPaAC,42,https://scholar.google.com/scholar?oi=bibs&hl=en&cites=9307569203727012044,['9307569203727012044']
 Chloride and Indium‐Chloride‐Complex Inorganic Ligands for Efficient Stabilization of Nanocrystals in Solution and Doping of Nanocrystal Solids, 2016,5uiQM3wAAAAJ:j6V8Syvup0UC,42,https://scholar.google.com/scholar?oi=bibs&hl=en&cites=9930553982748355774,['9930553982748355774']
 Breakdown and protection of ALD moisture barrier thin films, 2015,5uiQM3wAAAAJ:J6OZcwVsj5AC,42,https://scholar.google.com/scholar?oi=bibs&hl=en&cites=5771444827283541970,['5771444827283541970']
 Organic photoactive device, 2013,5uiQM3wAAAAJ:QUX0mv85b1cC,42,https://scholar.google.com/scholar?oi=bibs&hl=en&cites=14387501748192012956,['14387501748192012956']
 A comparison of two air-stable molecular n-dopants for C60, 2012,5uiQM3wAAAAJ:4X0JR2_MtJMC,42,https://scholar.google.com/scholar?oi=bibs&hl=en&cites=18184492231397647338,['18184492231397647338']
 Ionized impurity scattering in -doped  thin films, 2007,5uiQM3wAAAAJ:ILKRHgRFtOwC,42,https://scholar.google.com/scholar?oi=bibs&hl=en&cites=7626433969009220406,['7626433969009220406']
 Morphological and optical properties of titanyl phthalocyanine films deposited by supersonic molecular beam epitaxy (SuMBE), 2004,5uiQM3wAAAAJ:LPZeul_q3PIC,42,https://scholar.google.com/scholar?oi=bibs&hl=en&cites=3481947929592154189,['3481947929592154189']
 Bioinspiration in light harvesting and catalysis, 2020,5uiQM3wAAAAJ:LiF7i2gyBHwC,41,https://scholar.google.com/scholar?oi=bibs&hl=en&cites=14118999346737785704,['14118999346737785704']
 Electrical limit of silver nanowire electrodes Direct measurement of the nanowire junction resistance, 2016,5uiQM3wAAAAJ:43B52WW2E64C,41,https://scholar.google.com/scholar?oi=bibs&hl=en&cites=10279398947997889064,['10279398947997889064']
 Photo‐patterning of highly efficient state‐of‐the‐art phosphorescent OLEDs using orthogonal hydrofluoroethers, 2014,5uiQM3wAAAAJ:9VeumLvkZSQC,41,https://scholar.google.com/scholar?oi=bibs&hl=en&cites=10175397762973549257,['10175397762973549257']
 Open circuit voltage and IV curve shape of ZnPcC60 solar cells with varied mixing ratio and hole transport layer, 2011,5uiQM3wAAAAJ:SpbeaW3--B0C,41,https://scholar.google.com/scholar?oi=bibs&hl=en&cites=16761935066269911385,['16761935066269911385']
 The structure of [4-(phenylazo) phenoxy] hexane-1-thiol self-assembled monolayers on Au (111), 2002,5uiQM3wAAAAJ:dQ2og3OwTAUC,41,https://scholar.google.com/scholar?oi=bibs&hl=en&cites=13932359112938648330,['13932359112938648330']
 Dissociation of excitons in organic dye layers of perylene derivatives, 2000,5uiQM3wAAAAJ:WA5NYHcadZ8C,41,https://scholar.google.com/scholar?oi=bibs&hl=en&cites=14459177714566341646,['14459177714566341646']
 Energy losing rate and open-circuit voltage analysis of organic solar cells based on detailed photocurrent simulation, 2009,5uiQM3wAAAAJ:ZJ-noXUx9mkC,40,https://scholar.google.com/scholar?oi=bibs&hl=en&cites=14172242068871673770,['14172242068871673770']
 Low operating voltage and high efficiency organic multilayer electroluminescent devices with p-type doped hole injection layer, 2001,5uiQM3wAAAAJ:XiVPGOgt02cC,40,https://scholar.google.com/scholar?oi=bibs&hl=en&cites=17304736862275738240,['17304736862275738240']
 Enhanced light emission from top-emitting organic light-emitting diodes by optimizing surface plasmon polariton losses, 2015,5uiQM3wAAAAJ:tFzHCjejgA0C,39,https://scholar.google.com/scholar?oi=bibs&hl=en&cites=10614330994320519060,['10614330994320519060']
 Unusually high optical transmission in Ca Ag blend films high‐performance top electrodes for efficient organic solar cells, 2014,5uiQM3wAAAAJ:5F1dSjz1ScoC,39,https://scholar.google.com/scholar?oi=bibs&hl=en&cites=9632664014741938957,['9632664014741938957']
 Alternative p-doped hole transport material for low operating voltage and high efficiency organic light-emitting diodes, 2014,5uiQM3wAAAAJ:kvJssbFybhEC,39,https://scholar.google.com/scholar?oi=bibs&hl=en&cites=6182232912510739768,['6182232912510739768']
 Laser desorption/ionization time-of-flight mass spectrometry A predictive tool for the lifetime of organic light emitting devices, 2009,5uiQM3wAAAAJ:gsN89kCJA0AC,39,https://scholar.google.com/scholar?oi=bibs&hl=en&cites=13687401073521167048,['13687401073521167048']
 Tunneling in semiconductor heterostructures studied by subpicosecond four‐wave mixing, 1990,5uiQM3wAAAAJ:K3LRdlH-MEoC,39,https://scholar.google.com/scholar?oi=bibs&hl=en&cites=11784438306436000650,['11784438306436000650']
 10.4% Efficient triple organic solar cells containing near infrared absorbers, 2016,5uiQM3wAAAAJ:WgvcDLhf7hwC,38,https://scholar.google.com/scholar?oi=bibs&hl=en&cites=1260443348266421422,['1260443348266421422']
" Color-stable, ITO-free white organic light-emitting diodes with enhanced efficiency using solution-processed transparent electrodes and optical outcoupling layers", 2014,5uiQM3wAAAAJ:MNNNGtAgD4EC,38,https://scholar.google.com/scholar?oi=bibs&hl=en&cites=3136570136030361156,['3136570136030361156']
 Quantification of deep hole-trap filling by molecular p-doping Dependence on the host material purity, 2013,5uiQM3wAAAAJ:oi2SiIJ9l4AC,38,https://scholar.google.com/scholar?oi=bibs&hl=en&cites=18155378684708403921,['18155378684708403921']
 White top-emitting organic light-emitting diodes employing a heterostructure of down-conversion layers, 2011,5uiQM3wAAAAJ:LO7wyVUgiFcC,38,https://scholar.google.com/scholar?oi=bibs&hl=en&cites=13078101662538824218,['13078101662538824218']
 Influence of organic capping layers on the performance of transparent organic light-emitting diodes, 2011,5uiQM3wAAAAJ:oNZyr7d5Mn4C,38,https://scholar.google.com/scholar?oi=bibs&hl=en&cites=8122419723989988918,['8122419723989988918']
 53.3 Influence of material purification by vacuum sublimation on organic optoelectronic device performance, 2006,5uiQM3wAAAAJ:z_wVstp3MssC,38,https://scholar.google.com/scholar?oi=bibs&hl=en&cites=13458434029993834790,['13458434029993834790']
 Determination of minority carrier lifetimes in CuInSe2 thin films, 1996,5uiQM3wAAAAJ:0KyAp5RtaNEC,38,https://scholar.google.com/scholar?oi=bibs&hl=en&cites=17313500625445431716,['17313500625445431716']
 Influence of carrier lifetime on the cooling of a hot electron-hole plasma in GaAs, 1987,5uiQM3wAAAAJ:tkaPQYYpVKoC,38,https://scholar.google.com/scholar?oi=bibs&hl=en&cites=4703299469375193978,['4703299469375193978']
 A review of vertical organic transistors, 2020,5uiQM3wAAAAJ:ipSP0SfFaZ8C,37,https://scholar.google.com/scholar?oi=bibs&hl=en&cites=12404088544503617783,['12404088544503617783']
 Investigation of triplet harvesting and outcoupling efficiency in highly efficient two‐color hybrid white organic light‐emitting diodes, 2013,5uiQM3wAAAAJ:JH5k92_tO-AC,37,https://scholar.google.com/scholar?oi=bibs&hl=en&cites=8656273687247892632,['8656273687247892632']
" Tunneling spectroscopy study of 3, 4, 9, 10-perylenetetracarboxylic dianhydride on Au (1 0 0)", 2001,5uiQM3wAAAAJ:mvPsJ3kp5DgC,37,https://scholar.google.com/scholar?oi=bibs&hl=en&cites=3331342324112349307,['3331342324112349307']
 A simple measurement of the absolute internal quantum efficiency of thin organic films, 2000,5uiQM3wAAAAJ:SdhP9T11ey4C,37,https://scholar.google.com/scholar?oi=bibs&hl=en&cites=17355902160278395216,['17355902160278395216']
 Controlling Tamm plasmons for organic narrowband near-infrared photodetectors, 2017,5uiQM3wAAAAJ:uoeYKOKFegwC,36,https://scholar.google.com/scholar?oi=bibs&hl=en&cites=16907561086271043246,['16907561086271043246']
 Organic power electronics transistor operation in the kA/cm 2 Regime, 2017,5uiQM3wAAAAJ:1YatL4jblGcC,36,https://scholar.google.com/scholar?oi=bibs&hl=en&cites=5885246354275182512,['5885246354275182512']
 Influence of side groups on the performance of infrared absorbing aza‐BODIPY organic solar cells, 2015,5uiQM3wAAAAJ:Zbx7W2Xs4QsC,36,https://scholar.google.com/scholar?oi=bibs&hl=en&cites=8932879796151822471,['8932879796151822471']
 Molecular doping for control of gate bias stress in organic thin film transistors, 2014,5uiQM3wAAAAJ:YPNY0knpFBYC,36,https://scholar.google.com/scholar?oi=bibs&hl=en&cites=7032920833910601451,['7032920833910601451']
 Self-heating effects in organic semiconductor crossbar structures with small active area, 2012,5uiQM3wAAAAJ:Ak0FvsSvgGUC,36,https://scholar.google.com/scholar?oi=bibs&hl=en&cites=9074454014409849813,['9074454014409849813']
 High brightness alternating current electroluminescence with organic light emitting material, 2012,5uiQM3wAAAAJ:IRz6iEL74y4C,36,https://scholar.google.com/scholar?oi=bibs&hl=en&cites=4103332424429103474,['4103332424429103474']
 Effect of concentration gradients in ZnPc C60 bulk heterojunction organic solar cells, 2011,5uiQM3wAAAAJ:Aul-kAQHnToC,36,https://scholar.google.com/scholar?oi=bibs&hl=en&cites=5411426696761204191,['5411426696761204191']
 Organic solar cells with a multicharge separation structure consisting of a thin rubrene fluorescent dye for open circuit voltage enhancement, 2011,5uiQM3wAAAAJ:aVq8r21TQD4C,36,https://scholar.google.com/scholar?oi=bibs&hl=en&cites=6982507606589635483,['6982507606589635483']
 Passivation of Molecular n‐Doping Exploring the Limits of Air Stability, 2016,5uiQM3wAAAAJ:puFLaqDw8dcC,35,https://scholar.google.com/scholar?oi=bibs&hl=en&cites=7089997424913959225,['7089997424913959225']
 Organic pin-diodes approaching ultra-high-frequencies, 2012,5uiQM3wAAAAJ:6_hjMsCP8ZoC,35,https://scholar.google.com/scholar?oi=bibs&hl=en&cites=17739853797731049025,['17739853797731049025']
 Systematic investigation of transparent organic light-emitting diodes depending on top metal electrode thickness, 2011,5uiQM3wAAAAJ:-FonjvnnhkoC,35,https://scholar.google.com/scholar?oi=bibs&hl=en&cites=13833021232714844173,['13833021232714844173']
 Blue luminescent isolated  molecules in a solid-state matrix, 2006,5uiQM3wAAAAJ:p__nRnzSRKYC,35,https://scholar.google.com/scholar?oi=bibs&hl=en&cites=2082545567277629133,['2082545567277629133']
 4.4L Late‐News Paper Novel OLEDs for Full Color Displays with Highest Power Efficiencies and Long Lifetime, 2005,5uiQM3wAAAAJ:wbdj-CoPYUoC,35,"https://scholar.google.com/scholar?oi=bibs&hl=en&cites=11138933277883100317,8722377537304592013","['11138933277883100317', '8722377537304592013']"
 Coherent and incoherent tunneling in asymmetric double quantum wells, 1992,5uiQM3wAAAAJ:dTyEYWd-f8wC,35,https://scholar.google.com/scholar?oi=bibs&hl=en&cites=5815153592974774480,['5815153592974774480']
 Electron-hole plasma dynamics in CdTe in the picosecond regime, 1989,5uiQM3wAAAAJ:JQOojiI6XY0C,35,https://scholar.google.com/scholar?oi=bibs&hl=en&cites=17979924005897096223,['17979924005897096223']
