Title,Pub_Year,author_pub_id,num_citations,citedby_url,cites_id
 Morphology and molecular orientation of ethyl-substituted dicyanovinyl-sexithiophene films for photovoltaic applications, 2012,5uiQM3wAAAAJ:H7nrzBkawXsC,20,https://scholar.google.com/scholar?oi=bibs&hl=en&cites=6973306984931792697,['6973306984931792697']
 Optical characterization of strain-induced structural modification in SiGe-based heterostructures, 1999,5uiQM3wAAAAJ:2KloaMYe4IUC,20,https://scholar.google.com/scholar?oi=bibs&hl=en&cites=16442257096439227403,['16442257096439227403']
 Experimental realization of the Bloch oscillator in a semiconductor superlattice, 1994,5uiQM3wAAAAJ:k8Z6L05lTy4C,20,https://scholar.google.com/scholar?oi=bibs&hl=en&cites=17535575712877836046,['17535575712877836046']
 Photonic confinement in laterally structured metal-organic microcavities, 2014,5uiQM3wAAAAJ:g30IDTdgJMgC,19,https://scholar.google.com/scholar?oi=bibs&hl=en&cites=149594638891377391,['149594638891377391']
 Bi‐directional organic light‐emitting diodes with nanoparticle‐enhanced light outcoupling, 2013,5uiQM3wAAAAJ:j8pvxH-kN2QC,19,https://scholar.google.com/scholar?oi=bibs&hl=en&cites=16028888552020172257,['16028888552020172257']
 Total charge amount as indicator for the degradation of small molecule organic solar cells, 2011,5uiQM3wAAAAJ:5MTHONV0fEkC,19,https://scholar.google.com/scholar?oi=bibs&hl=en&cites=13756525163604819563,['13756525163604819563']
 Organic heterostructure device with nonvolatile memory behavior using electrically doped layers, 2008,5uiQM3wAAAAJ:i2xiXl-TujoC,19,https://scholar.google.com/scholar?oi=bibs&hl=en&cites=16752775557507750236,['16752775557507750236']
 Absorption spectra and band structure of mixed Frenkel-charge-transfer vibronic states in one-dimensional molecular crystals, 2002,5uiQM3wAAAAJ:URolC5Kub84C,19,https://scholar.google.com/scholar?oi=bibs&hl=en&cites=12379974232130124378,['12379974232130124378']
 Blue and violet photoluminescence from high-dose Si+-and Ge+-implanted silicon dioxide layers, 1997,5uiQM3wAAAAJ:EYYDruWGBe4C,19,https://scholar.google.com/scholar?oi=bibs&hl=en&cites=6205677365451316660,['6205677365451316660']
 Reverse dark current in organic photodetectors and the major role of traps as source of noise, 2021,5uiQM3wAAAAJ:RwQ8IgSj6xkC,18,https://scholar.google.com/scholar?oi=bibs&hl=en&cites=4414852561053153185,['4414852561053153185']
 Non-volatile organic memory devices comprising SiO2 and C60 showing 104 switching cycles, 2012,5uiQM3wAAAAJ:Xz60mAmATU4C,18,https://scholar.google.com/scholar?oi=bibs&hl=en&cites=18317712844853362887,['18317712844853362887']
 Efficient and long-term stable organic vacuum deposited tandem solar cells, 2010,5uiQM3wAAAAJ:4vMrXwiscB8C,18,https://scholar.google.com/scholar?oi=bibs&hl=en&cites=11573589510706328859,['11573589510706328859']
 29.1 Full Color Active Matrix OLED Displays with High Aperture Ratio, 2004,5uiQM3wAAAAJ:ML0RJ9NH7IQC,18,https://scholar.google.com/scholar?oi=bibs&hl=en&cites=5717034356051780366,['5717034356051780366']
 Surface states in molecular chains with strong mixing of Frenkel and charge-transfer excitons, 2000,5uiQM3wAAAAJ:HbR8gkJAVGIC,18,https://scholar.google.com/scholar?oi=bibs&hl=en&cites=3842666313035074234,['3842666313035074234']
 Charge transport in thin organic semiconducting films Seebeck and field effect studies, 1997,5uiQM3wAAAAJ:XoXfffV-tXoC,18,https://scholar.google.com/scholar?oi=bibs&hl=en&cites=8518828400981993586,['8518828400981993586']
" G. von lessen, A. Schulze, P. Thomas, and S. Schmitt-Rink", 1992,5uiQM3wAAAAJ:F0CZgh39Fi0C,18,https://scholar.google.com/scholar?oi=bibs&hl=en&cites=11355758420306501352,['11355758420306501352']
 Boron dipyrromethene (BODIPY) with meso-perfluorinated alkyl substituents as near infrared donors in organic solar cells, 2018,5uiQM3wAAAAJ:WsFh9Szeq2wC,17,https://scholar.google.com/scholar?oi=bibs&hl=en&cites=1286045171906059784,['1286045171906059784']
 Degradation of sexithiophene cascade organic solar cells, 2016,5uiQM3wAAAAJ:-qpA3cGbmHsC,17,https://scholar.google.com/scholar?oi=bibs&hl=en&cites=7333223535482048811,['7333223535482048811']
 Controlling morphology A vertical organic transistor with a self-structured permeable base using the bottom electrode as seed layer, 2015,5uiQM3wAAAAJ:r56sNq9gaawC,17,https://scholar.google.com/scholar?oi=bibs&hl=en&cites=2490659291506455887,['2490659291506455887']
 Integration of molecular-layer-deposited aluminum alkoxide interlayers into inorganic nanolaminate barriers for encapsulation of organic electronics with improved stress resistance, 2015,5uiQM3wAAAAJ:nroGzMJTTpEC,17,https://scholar.google.com/scholar?oi=bibs&hl=en&cites=9906436178032024357,['9906436178032024357']
 Dynamic Effects on the Charge Transport in an Organic Near-Infrared Absorber Material, 2014,5uiQM3wAAAAJ:za7pDTvVV8kC,17,https://scholar.google.com/scholar?oi=bibs&hl=en&cites=17319346477929537135,['17319346477929537135']
 Observation of feature ripening inversion effect at the percolation threshold for the growth of thin silver films, 2014,5uiQM3wAAAAJ:_IsBomjs8bsC,17,https://scholar.google.com/scholar?oi=bibs&hl=en&cites=14486612422604729963,['14486612422604729963']
 Note Influence of calcium corrosion on the performance of an adjacent permeation barrier, 2014,5uiQM3wAAAAJ:HKviVsUxM5wC,17,https://scholar.google.com/scholar?oi=bibs&hl=en&cites=12733602389376071693,['12733602389376071693']
 White light emission from alternating current organic light‐emitting devices using high frequency color‐mixing, 2013,5uiQM3wAAAAJ:SxCCDk4iOpsC,17,https://scholar.google.com/scholar?oi=bibs&hl=en&cites=1977909821750944450,['1977909821750944450']
 Spectral delay algebraic equation approach to broad area laser diodes, 2013,5uiQM3wAAAAJ:O0MA3yP7Y3UC,17,"https://scholar.google.com/scholar?oi=bibs&hl=en&cites=11238844466565339052,10479743681489067919,13044667068945902535","['11238844466565339052', '10479743681489067919', '13044667068945902535']"
 Multimode laser emission from laterally confined organic microcavities, 2009,5uiQM3wAAAAJ:8d8msizDQcsC,17,https://scholar.google.com/scholar?oi=bibs&hl=en&cites=12100807835709291200,['12100807835709291200']
" Comment on “Roles of donor and acceptor nanodomains in 6% efficient thermally annealed polymer photovoltaics”[Appl. Phys. Lett. 90, 163511 (2007)]", 2008,5uiQM3wAAAAJ:QC-2xSqExF4C,17,https://scholar.google.com/scholar?oi=bibs&hl=en&cites=1431659255737084869,['1431659255737084869']
 Organic Light-Emitting Diodes and an Arrangement with Several Organic Light-Emitting Diodes, 2007,5uiQM3wAAAAJ:SnGPuo6Feq8C,17,https://scholar.google.com/scholar?oi=bibs&hl=en&cites=15505434117918397035,['15505434117918397035']
 Vertical Organic Thin‐Film Transistors with an Anodized Permeable Base for Very Low Leakage Current, 2019,5uiQM3wAAAAJ:AzjrKLz9U9oC,16,https://scholar.google.com/scholar?oi=bibs&hl=en&cites=7951279395641300438,['7951279395641300438']
 Dielectric function of a poly (benzimidazobenzophenanthroline) ladder polymer, 2015,5uiQM3wAAAAJ:DPO9WFcz7UcC,16,https://scholar.google.com/scholar?oi=bibs&hl=en&cites=5428362886200755239,['5428362886200755239']
 A charge carrier transport model for donor-acceptor blend layers, 2015,5uiQM3wAAAAJ:bbjcffOLshcC,16,https://scholar.google.com/scholar?oi=bibs&hl=en&cites=4252680908310008479,['4252680908310008479']
 Collecting the Electrons on n‐Doped Fullerene C60 Transparent Conductors for All‐Vacuum‐Deposited Small‐Molecule Organic Solar Cells, 2013,5uiQM3wAAAAJ:v_tt_AnqfNMC,16,https://scholar.google.com/scholar?oi=bibs&hl=en&cites=9070030752177986662,['9070030752177986662']
 Highly doped fullerene C60 thin films as transparent stand alone top electrode for organic solar cells, 2013,5uiQM3wAAAAJ:Hck25ST_3aIC,16,https://scholar.google.com/scholar?oi=bibs&hl=en&cites=7879329483329742008,['7879329483329742008']
 Dispersion tomography of an organic photonic-wire microcavity, 2013,5uiQM3wAAAAJ:KWzIFqRkAKkC,16,https://scholar.google.com/scholar?oi=bibs&hl=en&cites=1229040664552306097,['1229040664552306097']
 Photoelectron spectroscopy investigations of recombination contacts for tandem organic solar cells, 2012,5uiQM3wAAAAJ:nZcligLrVowC,16,https://scholar.google.com/scholar?oi=bibs&hl=en&cites=5915351980885909508,['5915351980885909508']
 Quantitative estimation of electronic quality of zinc phthalocyanine thin films, 2011,5uiQM3wAAAAJ:FiytvqdAVhgC,16,https://scholar.google.com/scholar?oi=bibs&hl=en&cites=18304091205835340160,['18304091205835340160']
 Structure–property relationship of acceptor-substituted oligothiophenes, 2010,5uiQM3wAAAAJ:MhiOAD_qIWkC,16,https://scholar.google.com/scholar?oi=bibs&hl=en&cites=1038285344532395344,['1038285344532395344']
 Photoactive device with organic layers, 2009,5uiQM3wAAAAJ:PQEM9vzQD9gC,16,https://scholar.google.com/scholar?oi=bibs&hl=en&cites=14044853368395650914,['14044853368395650914']
 Transparent conductive layers for organic solar cells simulation and experiment, 2009,5uiQM3wAAAAJ:FPJr55Dyh1AC,16,https://scholar.google.com/scholar?oi=bibs&hl=en&cites=2974149411571781560,['2974149411571781560']
 Thermally evaporated methylammonium-free perovskite solar cells, 2020,5uiQM3wAAAAJ:gNZucvRojEcC,15,https://scholar.google.com/scholar?oi=bibs&hl=en&cites=2589885898743667919,['2589885898743667919']
 Effect of H-and J-Aggregation on the Photophysical and Voltage Loss of Boron Dipyrromethene Small Molecules in Vacuum-Deposited Organic Solar Cells, 2019,5uiQM3wAAAAJ:XAEgxC7iu0MC,15,https://scholar.google.com/scholar?oi=bibs&hl=en&cites=10230469535816827104,['10230469535816827104']
 High electron affinity molecular dopant CN6-CP for efficient organic light-emitting diodes, 2019,5uiQM3wAAAAJ:hXkWDDAEazwC,15,https://scholar.google.com/scholar?oi=bibs&hl=en&cites=1827392913755498047,['1827392913755498047']
 Balance of horizontal and vertical charge transport in organic field-effect transistors, 2018,5uiQM3wAAAAJ:vrnMIr82eJkC,15,https://scholar.google.com/scholar?oi=bibs&hl=en&cites=966513267315289792,['966513267315289792']
 Non-linear self-heating in organic transistors reaching high power densities, 2018,5uiQM3wAAAAJ:Gs1AF5H0x94C,15,https://scholar.google.com/scholar?oi=bibs&hl=en&cites=11917765922714233279,['11917765922714233279']
 Color temperature tuning of white organic light-emitting diodes via spatial control of micro-cavity effects based on thin metal strips, 2015,5uiQM3wAAAAJ:v6PuF9mNY3oC,15,https://scholar.google.com/scholar?oi=bibs&hl=en&cites=5869388558942323501,['5869388558942323501']
" Ultrafast pump-probe reflectance spectroscopy Why sodium makes Cu (In, Ga) Se2 solar cells better", 2015,5uiQM3wAAAAJ:PklR0melJeUC,15,https://scholar.google.com/scholar?oi=bibs&hl=en&cites=15028562254460543228,['15028562254460543228']
 Exploiting diffusion currents at Ohmic contacts for trap characterization in organic semiconductors, 2014,5uiQM3wAAAAJ:uEM9VtRl8xsC,15,https://scholar.google.com/scholar?oi=bibs&hl=en&cites=2635198938349330789,['2635198938349330789']
 Optimizing the internal electric field distribution of alternating current driven organic light-emitting devices for a reduced operating voltage, 2014,5uiQM3wAAAAJ:dFKc6_kCK1wC,15,https://scholar.google.com/scholar?oi=bibs&hl=en&cites=3812286980075829959,['3812286980075829959']
 Diindenoperylene derivatives A model to investigate the path from molecular structure via morphology to solar cell performance, 2013,5uiQM3wAAAAJ:sszUF3NjhM4C,15,https://scholar.google.com/scholar?oi=bibs&hl=en&cites=8661658763483490457,['8661658763483490457']
" 36‐1 Invited Paper 2nd Generation Organics High Power Efficiency, Ultra Long Life, and Low‐Cost OLED Devices", 2007,5uiQM3wAAAAJ:zCSUwVk65WsC,15,https://scholar.google.com/scholar?oi=bibs&hl=en&cites=6231443308057722536,['6231443308057722536']
 Electroluminescent assembly, 2005,5uiQM3wAAAAJ:G1UMdFYMoxkC,15,https://scholar.google.com/scholar?oi=bibs&hl=en&cites=15346610457891152598,['15346610457891152598']
 High Efficiency Top Emitting OLEDs on a-Si Active Matrix Backplanes with Large Aperture Ratio, 2004,5uiQM3wAAAAJ:_5tno0g5mFcC,15,https://scholar.google.com/scholar?oi=bibs&hl=en&cites=704949448944448099,['704949448944448099']
 Excimer dynamics in ultrathin organic films, 1997,5uiQM3wAAAAJ:OcBU2YAGkTUC,15,https://scholar.google.com/scholar?oi=bibs&hl=en&cites=17395213181667773945,['17395213181667773945']
 Novel organic light-emitting diode design for future lasing applications, 2017,5uiQM3wAAAAJ:plAW456RD7MC,14,https://scholar.google.com/scholar?oi=bibs&hl=en&cites=3470616058448540896,['3470616058448540896']
" The impact of molecular weight, air exposure and molecular doping on the charge transport properties and electronic defects in dithienyl-diketopyrrolopyrrole-thieno [3, 2-b …", 2016,5uiQM3wAAAAJ:UY3hNwcQ290C,14,https://scholar.google.com/scholar?oi=bibs&hl=en&cites=10336740051407431944,['10336740051407431944']
 Impact of temperature on the efficiency of organic light emitting diodes, 2015,5uiQM3wAAAAJ:ON9TkA72AHEC,14,https://scholar.google.com/scholar?oi=bibs&hl=en&cites=5759755420348733482,['5759755420348733482']
 Eclipse Pulsed Laser Deposition for Damage‐Free Preparation of Transparent ZnO Electrodes on Top of Organic Solar Cells, 2015,5uiQM3wAAAAJ:MqTxh1vmwXEC,14,https://scholar.google.com/scholar?oi=bibs&hl=en&cites=12329992919363658006,['12329992919363658006']
 Influence of bilayer resist processing on pin OLEDs towards multicolor photolithographic structuring of organic displays, 2015,5uiQM3wAAAAJ:1Aeql8wG3wEC,14,https://scholar.google.com/scholar?oi=bibs&hl=en&cites=177078717984415515,['177078717984415515']
 Zero‐and π‐States in a Periodic Array of Deep Photonic Wires, 2014,5uiQM3wAAAAJ:Q3-QASNKTMEC,14,https://scholar.google.com/scholar?oi=bibs&hl=en&cites=227346356493029812,['227346356493029812']
 Built-in voltage of organic bulk heterojuction pin solar cells measured by electroabsorption spectroscopy, 2014,5uiQM3wAAAAJ:pxXbYLTb8EgC,14,https://scholar.google.com/scholar?oi=bibs&hl=en&cites=11563532414249369096,['11563532414249369096']
 Organic Junction Field‐Effect Transistor, 2014,5uiQM3wAAAAJ:G36d5HCDkJYC,14,https://scholar.google.com/scholar?oi=bibs&hl=en&cites=11077734504885360529,['11077734504885360529']
 Influence of phosphorescent dopants in organic light-emitting diodes with an organic homojunction, 2012,5uiQM3wAAAAJ:WHdLCjDvYFkC,14,https://scholar.google.com/scholar?oi=bibs&hl=en&cites=1439070503684090787,['1439070503684090787']
 Investigation on the origin of the memory effect in metal/organic semiconductor/metal structures, 2011,5uiQM3wAAAAJ:-mN3Mh-tlDkC,14,https://scholar.google.com/scholar?oi=bibs&hl=en&cites=9152841494380576925,['9152841494380576925']
 Saturation of laser emission in a small mode volume organic microcavity, 2011,5uiQM3wAAAAJ:27LrP4qxOz0C,14,https://scholar.google.com/scholar?oi=bibs&hl=en&cites=3478084476359241862,['3478084476359241862']
 Photoelectron spectroscopy investigation of thin metal films employed as top contacts in transparent organic solar cells, 2011,5uiQM3wAAAAJ:NyGDZy8z5eUC,14,https://scholar.google.com/scholar?oi=bibs&hl=en&cites=13999002801387690534,['13999002801387690534']
 Efficiency and lifetime enhancement of phosphorescent organic devices, 2008,5uiQM3wAAAAJ:IUKN3-7HHlwC,14,https://scholar.google.com/scholar?oi=bibs&hl=en&cites=5919554492953268416,['5919554492953268416']
 41.3 In‐Line Deposition of High‐Efficiency p‐i‐n Organic Light‐Emitting Devices, 2006,5uiQM3wAAAAJ:gKiMpY-AVTkC,14,https://scholar.google.com/scholar?oi=bibs&hl=en&cites=857670744003108120,['857670744003108120']
 Coherent control of Bloch oscillations by means of optical pulse shaping, 2005,5uiQM3wAAAAJ:9pM33mqn1YgC,14,https://scholar.google.com/scholar?oi=bibs&hl=en&cites=6391769221397214787,['6391769221397214787']
 Time‐resolved luminescence study of ultrafast carrier transport in GaAs metal‐semiconductor‐metal devices, 1993,5uiQM3wAAAAJ:edDO8Oi4QzsC,14,https://scholar.google.com/scholar?oi=bibs&hl=en&cites=17299647345990313817,['17299647345990313817']
 Doping-induced carrier profiles in organic semiconductors determined from capacitive extraction-current transients, 2017,5uiQM3wAAAAJ:pYRxIbzCxX0C,13,https://scholar.google.com/scholar?oi=bibs&hl=en&cites=4030925141654808169,['4030925141654808169']
 Laminated aluminum thin-films as low-cost opaque moisture ultra-barriers for flexible organic electronic devices, 2017,5uiQM3wAAAAJ:ef2wPL15CskC,13,https://scholar.google.com/scholar?oi=bibs&hl=en&cites=11063042680357660088,['11063042680357660088']
 Transparent organic light-emitting diodes with different bi-directional emission colors using color-conversion capping layers, 2015,5uiQM3wAAAAJ:qbqt7gslDFUC,13,https://scholar.google.com/scholar?oi=bibs&hl=en&cites=15192165580605495,['15192165580605495']
 Novel PINP top-emitting organic light-emitting diodes with enhanced efficiency and stability, 2013,5uiQM3wAAAAJ:dAp6zn-oMfAC,13,https://scholar.google.com/scholar?oi=bibs&hl=en&cites=3285434171964963329,['3285434171964963329']
 Coupled plasmonic modes in organic planar microcavities, 2012,5uiQM3wAAAAJ:KNjnJ3z-R6IC,13,https://scholar.google.com/scholar?oi=bibs&hl=en&cites=13657859513579184421,['13657859513579184421']
" Effect of film thickness, type of buffer layer, and substrate temperature on the morphology of dicyanovinyl-substituted sexithiophene films", 2012,5uiQM3wAAAAJ:rHJHxKgnXwkC,13,https://scholar.google.com/scholar?oi=bibs&hl=en&cites=16235532700259556532,['16235532700259556532']
" On-substrate polymerization of solution-processed, transparent PEDOT DDQ thin film electrodes with a hydrophobic polymer matrix", 2011,5uiQM3wAAAAJ:1Ye0OR6EYb4C,13,https://scholar.google.com/scholar?oi=bibs&hl=en&cites=1705718187333203167,['1705718187333203167']
 Increased and balanced light emission of transparent organic light-emitting diodes by enhanced microcavity effects, 2011,5uiQM3wAAAAJ:otzGkya1bYkC,13,https://scholar.google.com/scholar?oi=bibs&hl=en&cites=730423328970063047,['730423328970063047']
 Organic solar cells with very high fill factor and voltage using tetrapropyl‐tetraphenyl‐diindenoperylene as green donor, 2010,5uiQM3wAAAAJ:BJbdYPG6LGMC,13,https://scholar.google.com/scholar?oi=bibs&hl=en&cites=3577834921776917099,['3577834921776917099']
 Rotatable function selectors in communication handsets and methods therefor, 2008,5uiQM3wAAAAJ:wZJMF1LD7PcC,13,https://scholar.google.com/scholar?oi=bibs&hl=en&cites=6711125097067043662,['6711125097067043662']
 Polarization splitting and terahertz oscillations from a single planar Fabry-Perot microcavity, 2006,5uiQM3wAAAAJ:bz8QjSJIRt4C,13,https://scholar.google.com/scholar?oi=bibs&hl=en&cites=4104303215488051866,['4104303215488051866']
 Time-resolved and cw photoluminescence from strongly coupled organic microcavities, 2004,5uiQM3wAAAAJ:bKqednn6t2AC,13,https://scholar.google.com/scholar?oi=bibs&hl=en&cites=14155459126006443865,['14155459126006443865']
 Morphology of InGaAs/InP QWs from excitonic spectroscopy to HR-TEM analyses, 1993,5uiQM3wAAAAJ:HIFyuExEbWQC,13,https://scholar.google.com/scholar?oi=bibs&hl=en&cites=11356665770914432174,['11356665770914432174']
 Hot carrier thermalization in GaAs/AlAs superlattices, 1989,5uiQM3wAAAAJ:HtEfBTGE9r8C,13,https://scholar.google.com/scholar?oi=bibs&hl=en&cites=17953860693363631595,['17953860693363631595']
 Ultrathin MoO3 Layers in Composite Metal Electrodes Improved Optics Allow Highly Efficient Organic Light‐Emitting Diodes, 2019,5uiQM3wAAAAJ:hXZnTIgIr50C,12,https://scholar.google.com/scholar?oi=bibs&hl=en&cites=6347885476083127831,['6347885476083127831']
 Optical In‐Coupling in Organic Solar Cells, 2018,5uiQM3wAAAAJ:2u1QkWOsl3MC,12,https://scholar.google.com/scholar?oi=bibs&hl=en&cites=16160480911734826772,['16160480911734826772']
 Optically pumped lasing of an electrically active hybrid OLED-microcavity, 2018,5uiQM3wAAAAJ:bFuYayV9R1gC,12,https://scholar.google.com/scholar?oi=bibs&hl=en&cites=13667804369372343496,['13667804369372343496']
 Very Small Inverted Hysteresis in Vacuum‐Deposited Mixed Organic–Inorganic Hybrid Perovskite Solar Cells, 2017,5uiQM3wAAAAJ:bxPAEoiBajcC,12,https://scholar.google.com/scholar?oi=bibs&hl=en&cites=17368621108350669733,['17368621108350669733']
 H-aggregated small molecular nanowires as near infrared absorbers for organic solar cells, 2017,5uiQM3wAAAAJ:h-xndbdg2koC,12,https://scholar.google.com/scholar?oi=bibs&hl=en&cites=6242309177269169742,['6242309177269169742']
 Determining doping efficiency and mobility from conductivity and Seebeck data of n‐doped C60 layers, 2015,5uiQM3wAAAAJ:Oj-SLI0tZTcC,12,https://scholar.google.com/scholar?oi=bibs&hl=en&cites=3166395282635734321,['3166395282635734321']
 Performance and lifetime of vacuum deposited organic light-emitting diodes Influence of residual gases present during device fabrication, 2014,5uiQM3wAAAAJ:o-PowTg_VKEC,12,https://scholar.google.com/scholar?oi=bibs&hl=en&cites=4188870395613319620,['4188870395613319620']
 Using interlayer step-wise triplet transfer to achieve an efficient white organic light-emitting diode with high color-stability, 2014,5uiQM3wAAAAJ:1paMEeroeoQC,12,https://scholar.google.com/scholar?oi=bibs&hl=en&cites=3285247772671066861,['3285247772671066861']
 Increase of charge carrier lifetime in dicyanovinyl–quinquethiophene fullerene blends upon deposition on heated substrates, 2011,5uiQM3wAAAAJ:DBa1UEJaJKAC,12,https://scholar.google.com/scholar?oi=bibs&hl=en&cites=16675702078354070970,['16675702078354070970']
 Efficiency enhancement of top-emitting organic light-emitting diodes using conversion dyes, 2011,5uiQM3wAAAAJ:jL-93Qbq4QoC,12,https://scholar.google.com/scholar?oi=bibs&hl=en&cites=15489557446946328074,['15489557446946328074']
 Comparison of different conditions for accelerated ageing of small molecule organic solar cells, 2010,5uiQM3wAAAAJ:cK4Rrx0J3m0C,12,https://scholar.google.com/scholar?oi=bibs&hl=en&cites=8231442370432304215,['8231442370432304215']
 Optical differential reflectance spectroscopy of molecular thin films on a metal evidence for strong oscillator strength increase, 2007,5uiQM3wAAAAJ:umqufdRvDiIC,12,https://scholar.google.com/scholar?oi=bibs&hl=en&cites=5298115902509687111,['5298115902509687111']
 Tailored heterojunctions for efficient thin-film organic solar cells a photoinduced absorption study, 2007,5uiQM3wAAAAJ:cWzG1nlazyYC,12,https://scholar.google.com/scholar?oi=bibs&hl=en&cites=12830070215008367947,['12830070215008367947']
 External field-dependent enhancement of internal Coulomb interactions in time-resolved four-wave mixing, 1995,5uiQM3wAAAAJ:g3aElNc5_aQC,12,https://scholar.google.com/scholar?oi=bibs&hl=en&cites=2369675288542151192,['2369675288542151192']
 Modulated ellipsometric measurements and transfer-matrix calculation of the field-dependent dielectric function of a multiple quantum well, 1992,5uiQM3wAAAAJ:4fGpz3EwCPoC,12,https://scholar.google.com/scholar?oi=bibs&hl=en&cites=5988719863008717932,['5988719863008717932']
 Colloidal PbS nanoplatelets synthesized via cation exchange for electronic applications, 2019,5uiQM3wAAAAJ:Ef4XXjhdXvQC,11,https://scholar.google.com/scholar?oi=bibs&hl=en&cites=9677487236784478145,['9677487236784478145']
 Microcavity‐Enhanced Semitransparent Electrodes for Oligothiophene Small‐Molecule Organic Solar Cells, 2017,5uiQM3wAAAAJ:OlbiQ0ttILcC,11,https://scholar.google.com/scholar?oi=bibs&hl=en&cites=5253156949772466139,['5253156949772466139']
 Top-gate organic depletion and inversion transistors with doped channel and injection contact, 2015,5uiQM3wAAAAJ:Lo8V22OuN40C,11,https://scholar.google.com/scholar?oi=bibs&hl=en&cites=10346502062972464256,['10346502062972464256']
 Lasing of Tamm states in highly efficient organic devices based on small-molecule organic semiconductors, 2014,5uiQM3wAAAAJ:GUYAmugLYisC,11,https://scholar.google.com/scholar?oi=bibs&hl=en&cites=956104355996742077,['956104355996742077']
 Investigating local (photo-) current and structure of ZnPc C60 bulk-heterojunctions, 2013,5uiQM3wAAAAJ:rqnDXT1GswoC,11,https://scholar.google.com/scholar?oi=bibs&hl=en&cites=17280701834306310388,['17280701834306310388']
 Tetrabutyl-tetraphenyl-diindenoperylene derivatives as alternative green donor in bulk heterojunction organic solar cells, 2011,5uiQM3wAAAAJ:IaI1MmNe2tcC,11,https://scholar.google.com/scholar?oi=bibs&hl=en&cites=15338009364820399045,['15338009364820399045']
" Transparent, Thermally Stable Light-Emitting Component Having Organic Layers", 2010,5uiQM3wAAAAJ:48xauSegjOkC,11,https://scholar.google.com/scholar?oi=bibs&hl=en&cites=9322508275330834792,['9322508275330834792']
 Photo-luminescence layer in the optical spectral region and in adjacent spectral regions, 2006,5uiQM3wAAAAJ:-jrNzM816MMC,11,"https://scholar.google.com/scholar?oi=bibs&hl=en&cites=7218300667751660513,14024433044446677509","['7218300667751660513', '14024433044446677509']"
 52.1 OLED Manufacturing Using Vertical In‐Line Machine Concept, 2003,5uiQM3wAAAAJ:ruyezt5ZtCIC,11,https://scholar.google.com/scholar?oi=bibs&hl=en&cites=7965522140040194533,['7965522140040194533']
 Thermal relaxation phenomena in the formation of device-quality SiO2/Si interfaces, 1993,5uiQM3wAAAAJ:DJbcl8HfkQkC,11,https://scholar.google.com/scholar?oi=bibs&hl=en&cites=4531571407488971470,['4531571407488971470']
 Stacked Dual‐Wavelength Near‐Infrared Organic Photodetectors, 2021,5uiQM3wAAAAJ:cAUKuAERoUMC,10,https://scholar.google.com/scholar?oi=bibs&hl=en&cites=3099384551711849120,['3099384551711849120']
 Precise patterning of organic semiconductors by reactive ion etching, 2020,5uiQM3wAAAAJ:pk6FPx6l9xIC,10,https://scholar.google.com/scholar?oi=bibs&hl=en&cites=5891029636025173544,['5891029636025173544']
