Title,Pub_Year,author_pub_id,num_citations,citedby_url,cites_id
 Erratum to “Organic solar cells based on a novel infrared absorbing aza-bodipy dye”(Sol. Energy Mater. Sol. Cells 99 (2012) 176–181), 2012,5uiQM3wAAAAJ:Gpwnp1kGG20C,2,https://scholar.google.com/scholar?oi=bibs&hl=en&cites=12703769172025380219,['12703769172025380219']
 Charge Carrier Mobility and Ageing of ZnPc/C60 Solar Cells, 2010,5uiQM3wAAAAJ:HJSXoJQnj-YC,2,https://scholar.google.com/scholar?oi=bibs&hl=en&cites=5101953469394224843,['5101953469394224843']
 Improved photon harvesting by employing C [sub] 70 [/sub] in bulk heterojunction solar cells, 2010,5uiQM3wAAAAJ:g5Ck-dwhA_QC,2,https://scholar.google.com/scholar?oi=bibs&hl=en&cites=12990981805552053582,['12990981805552053582']
 High efficient pin orange organic light emitting diode fabrication with novel Al cathode using DC magnetron sputtering, 2008,5uiQM3wAAAAJ:1DsIQWDZLl8C,2,https://scholar.google.com/scholar?oi=bibs&hl=en&cites=10997013684439325919,['10997013684439325919']
 Sub-nanojule threshold lasing in 5x5μm2 organic photonic boxes, 2008,5uiQM3wAAAAJ:CB2v5VPnA5kC,2,https://scholar.google.com/scholar?oi=bibs&hl=en&cites=2969152804490022164,['2969152804490022164']
 Integration of high-efficiency PIN organic light-emitting devices in lighting and optoelectronic applications, 2007,5uiQM3wAAAAJ:X9ykpCP0fEIC,2,https://scholar.google.com/scholar?oi=bibs&hl=en&cites=15066282420725579332,['15066282420725579332']
 Nonlinear transport in superlattices Bloch oscillations and Zener breakdown, 2001,5uiQM3wAAAAJ:BzfGm06jWhQC,2,https://scholar.google.com/scholar?oi=bibs&hl=en&cites=6398993985910973771,['6398993985910973771']
 Dynamics of Bloch oscillations influence of excitation conditions, 1999,5uiQM3wAAAAJ:-7ulzOJl1JYC,2,https://scholar.google.com/scholar?oi=bibs&hl=en&cites=2561777923597720773,['2561777923597720773']
 Coherent control of Bloch oscillations-from breathing mode quantum beats to spatial oscillations, 1998,5uiQM3wAAAAJ:mVC4hKzE2FoC,2,https://scholar.google.com/scholar?oi=bibs&hl=en&cites=15312480274162388255,['15312480274162388255']
 Effects of carrier relaxation on excitonic nonlinear absorption in GaAs quantum wells, 1994,5uiQM3wAAAAJ:8Xgff_V0N9gC,2,https://scholar.google.com/scholar?oi=bibs&hl=en&cites=12029961790887187438,['12029961790887187438']
 Experimental characterization of interface roughness in strained InGaAs/InP MQWs after a growth interruption sequence, 1993,5uiQM3wAAAAJ:ce2CqMG-AY4C,2,https://scholar.google.com/scholar?oi=bibs&hl=en&cites=10402639396627370023,['10402639396627370023']
 Dynamics of coherent optical excitations in semiconductor heterostructures, 1993,5uiQM3wAAAAJ:U_HPUtbDl20C,2,https://scholar.google.com/scholar?oi=bibs&hl=en&cites=8476733730161366949,['8476733730161366949']
 Ultrafast carrier dynamics in strained In 1− x Ga x As/InP heterostructures, 1992,5uiQM3wAAAAJ:wE-fMHVdjMkC,2,https://scholar.google.com/scholar?oi=bibs&hl=en&cites=2446601737740103091,['2446601737740103091']
 Subpicosecond spectroscopy of excitons in GaAs/AlGaAs heterostructures, 1992,5uiQM3wAAAAJ:TY5xIG7f_2sC,2,https://scholar.google.com/scholar?oi=bibs&hl=en&cites=9246885708268645454,['9246885708268645454']
 Electron-hole plasma relaxation in CdTe, 1990,5uiQM3wAAAAJ:0aBXIfxlw9sC,2,https://scholar.google.com/scholar?oi=bibs&hl=en&cites=16938825513129832585,['16938825513129832585']
 Supplementary information for},,5uiQM3wAAAAJ:TewouNez5YAC,2,https://scholar.google.com/scholar?oi=bibs&hl=en&cites=8524451147617140660,['8524451147617140660']
" Membrane-Free, Selective Ion Sensing by Combining Organic Electrochemical Transistors and Impedance Analysis of Ionic Diffusion", 2021,5uiQM3wAAAAJ:W91e3rS6dHEC,1,https://scholar.google.com/scholar?oi=bibs&hl=en&cites=13980965132461484661,['13980965132461484661']
 Integrated complementary inverters and ring oscillators based on vertical-channel dual-base organic thin-film transistors, 2021,5uiQM3wAAAAJ:8xglSJ46CyEC,1,https://scholar.google.com/scholar?oi=bibs&hl=en&cites=10866752961418999710,['10866752961418999710']
 Structural evolution and on-demand growth of artificial synapses via field-directed polymerization, 2021,5uiQM3wAAAAJ:tJ_1M1FLfZ0C,1,https://scholar.google.com/scholar?oi=bibs&hl=en&cites=7075409483109622019,['7075409483109622019']
 New charge-transfer states in blends of ZnPC with F8ZnPC, 2021,5uiQM3wAAAAJ:7LLGAk_PBK4C,1,https://scholar.google.com/scholar?oi=bibs&hl=en&cites=9981070155522346881,['9981070155522346881']
 Surface and mechanical analysis of metallized poly (dimethylsiloxane) gel for varifocal micromirrors, 2020,5uiQM3wAAAAJ:ThYxFsVAhEkC,1,https://scholar.google.com/scholar?oi=bibs&hl=en&cites=2928866022282759644,['2928866022282759644']
 Organic thin-film red-light photodiodes with tunable spectral response via selective exciton activation, 2020,5uiQM3wAAAAJ:vPKCt-r_nWsC,1,https://scholar.google.com/scholar?oi=bibs&hl=en&cites=10542124462768492705,['10542124462768492705']
 Venturing electronics into unknown grounds, 2018,5uiQM3wAAAAJ:uQyLbZAWguAC,1,https://scholar.google.com/scholar?oi=bibs&hl=en&cites=14622170578327187941,['14622170578327187941']
 Rubrene-based diodes for rectification applications (Conference Presentation), 2018,5uiQM3wAAAAJ:Z7R3Ocg27JUC,1,https://scholar.google.com/scholar?oi=bibs&hl=en&cites=9728944237635712891,['9728944237635712891']
 Method for detecting and converting infrared electromagnetic radiation, 2018,5uiQM3wAAAAJ:KYgttONoxcsC,1,https://scholar.google.com/scholar?oi=bibs&hl=en&cites=17421253656467479649,['17421253656467479649']
 Spatio-Temporal Analyses of Pesticide Use on Walnuts and Potential Risks to Surface Water in California, 2018,5uiQM3wAAAAJ:FwTEoIZreccC,1,"https://scholar.google.com/scholar?oi=bibs&hl=en&cites=14205634904723360472,8270090904080502003","['14205634904723360472', '8270090904080502003']"
 Method for manufacturing an organic electronic device and organic electronic device, 2017,5uiQM3wAAAAJ:iWL_APfBKHwC,1,https://scholar.google.com/scholar?oi=bibs&hl=en&cites=15310742050849835907,['15310742050849835907']
 Vertical organic transistor and production method, 2017,5uiQM3wAAAAJ:3A3nxV7CjKIC,1,https://scholar.google.com/scholar?oi=bibs&hl=en&cites=2064102792053140887,['2064102792053140887']
 Method for manufacturing an organic electronic device and organic electronic device, 2017,5uiQM3wAAAAJ:ibZ2AwG9z6wC,1,https://scholar.google.com/scholar?oi=bibs&hl=en&cites=17444794921675517743,['17444794921675517743']
 On Razors Edge Influence of the Source Insulator Edge on the Charge Transport of Vertical Organic Field Effect Transistors, 2017,5uiQM3wAAAAJ:jPVjDSAV6m0C,1,https://scholar.google.com/scholar?oi=bibs&hl=en&cites=7907551530641092617,['7907551530641092617']
 Light trapping for flexible organic photovoltaics, 2016,5uiQM3wAAAAJ:gL9scSG3K_gC,1,https://scholar.google.com/scholar?oi=bibs&hl=en&cites=16036306142665608356,['16036306142665608356']
 Method for Producing an Organic Light-Emitting Component and Organic Light-Emitting Component, 2015,5uiQM3wAAAAJ:zfsRRabFVBUC,1,https://scholar.google.com/scholar?oi=bibs&hl=en&cites=1017625216597082121,['1017625216597082121']
 Transparent electrode for optoelectronic components, 2015,5uiQM3wAAAAJ:WGv8Og3F3KgC,1,https://scholar.google.com/scholar?oi=bibs&hl=en&cites=10097395749763459235,['10097395749763459235']
 OLEDs light-emitting thin film thermistors revealing advanced self-heating effects, 2015,5uiQM3wAAAAJ:anDooRL1HQEC,1,https://scholar.google.com/scholar?oi=bibs&hl=en&cites=16386238361842098635,['16386238361842098635']
 Fano-Like Interference in the Emission Spectra of a Multimode Organic Microcavity, 2015,5uiQM3wAAAAJ:aNch6Af-aFkC,1,https://scholar.google.com/scholar?oi=bibs&hl=en&cites=15531324711964387813,['15531324711964387813']
 Photonics Zero‐and π‐States in a Periodic Array of Deep Photonic Wires (Advanced Optical Materials 8/2014), 2014,5uiQM3wAAAAJ:KsTgnNRry18C,1,https://scholar.google.com/scholar?oi=bibs&hl=en&cites=10577956362113645799,['10577956362113645799']
 Recent progress in organic solar cells From a lab curiosity to a serious photovoltaicTechnology, 2014,5uiQM3wAAAAJ:8gBurD7jEYQC,1,https://scholar.google.com/scholar?oi=bibs&hl=en&cites=10041457737814258971,['10041457737814258971']
 Electroabsorption studies of organic pin solar cells evaluating the built-in voltage, 2014,5uiQM3wAAAAJ:TeJ9juy8vcMC,1,https://scholar.google.com/scholar?oi=bibs&hl=en&cites=11635087371989539523,['11635087371989539523']
 Electro-thermal modeling of organic semiconductors describing negative differential resistance induced by self-heating, 2013,5uiQM3wAAAAJ:DQNrXyjhriIC,1,https://scholar.google.com/scholar?oi=bibs&hl=en&cites=10879842480392588677,['10879842480392588677']
 Organic Solar Cell or Photodetector Having Improved Absorption, 2012,5uiQM3wAAAAJ:W2uZP3ddy8sC,1,https://scholar.google.com/scholar?oi=bibs&hl=en&cites=2229622199948953151,['2229622199948953151']
 P‐116 Efficiency Enhancement in ITO‐free Green Organic Light Emitting Diodes Utilizing Nano‐Composite Scattering Films, 2012,5uiQM3wAAAAJ:Og1tA8FjbJAC,1,https://scholar.google.com/scholar?oi=bibs&hl=en&cites=3810284421043683750,['3810284421043683750']
" Publisher’s Note“Highly efficient semitransparent tandem organic solar cells with complementary absorber materials”[Appl. Phys. Lett. 99, 043301 (2011)]", 2012,5uiQM3wAAAAJ:yqZeyBDMhiUC,1,https://scholar.google.com/scholar?oi=bibs&hl=en&cites=12556229615638242400,['12556229615638242400']
 Bloch oscillations and ultrafast coherent optical phenomena, 2011,5uiQM3wAAAAJ:dj1AAMDQi3QC,1,https://scholar.google.com/scholar?oi=bibs&hl=en&cites=10686250835717987456,['10686250835717987456']
 Numerical drift-diffusion modeling of organic solar cells in comparison with experimental data series, 2010,5uiQM3wAAAAJ:4n0clTBhZ78C,1,https://scholar.google.com/scholar?oi=bibs&hl=en&cites=10427180342713060592,['10427180342713060592']
" Ito-Free, Semitransparent Small-Molecule Organic Solar Cells With Dibenzoperiflanthene as Absorber", 2010,5uiQM3wAAAAJ:NU-BerS4NX4C,1,https://scholar.google.com/scholar?oi=bibs&hl=en&cites=377785829603117099,['377785829603117099']
 Sonnige Aussichten mit organischen Solarzellen, 2010,5uiQM3wAAAAJ:eGYfIraVYiQC,1,https://scholar.google.com/scholar?oi=bibs&hl=en&cites=16806655482646501048,['16806655482646501048']
 White organic light-emitting diodes with top-emitting structure for high color quality and forward-directed light emission, 2010,5uiQM3wAAAAJ:L24QuVWYgZ0C,1,https://scholar.google.com/scholar?oi=bibs&hl=en&cites=6319691211516179802,['6319691211516179802']
 X-ray investigation of the morphology of DCV6T-Bu-4 films for Organic Solar Cells., 2010,5uiQM3wAAAAJ:UFuRdyijzaAC,1,https://scholar.google.com/scholar?oi=bibs&hl=en&cites=9069060924157334189,['9069060924157334189']
 Built-in potential of a pentacene pin homojunction studied by ultraviolet photoemission spectroscopy, 2010,5uiQM3wAAAAJ:xii_ZKWM4-0C,1,https://scholar.google.com/scholar?oi=bibs&hl=en&cites=17408098251733176973,['17408098251733176973']
 Ageing-dependent properties of ZnPc/C60 photovoltaic devices, 2010,5uiQM3wAAAAJ:Gb6Hms-Uo9kC,1,https://scholar.google.com/scholar?oi=bibs&hl=en&cites=8663196918918603654,['8663196918918603654']
" Erratum Pentacene homojunctions Electron and hole transport properties and related photovoltaic responses [Phys. Rev. B 77, 195212 (2008)]", 2008,5uiQM3wAAAAJ:w2UhwfzvF0QC,1,https://scholar.google.com/scholar?oi=bibs&hl=en&cites=11273601172575798959,['11273601172575798959']
 Measuring the energy level alignment at all interfaces in a complete OLED, 2008,5uiQM3wAAAAJ:gYnLYBw1zZMC,1,https://scholar.google.com/scholar?oi=bibs&hl=en&cites=11844176333068819686,['11844176333068819686']
 Dual-wavelength laser emission from an organic microcavity with terahertz beating, 2007,5uiQM3wAAAAJ:m92CDrhVnKEC,1,https://scholar.google.com/scholar?oi=bibs&hl=en&cites=3999495101981023680,['3999495101981023680']
 Improved efficiency of zinc phthalocyanine, 2007,5uiQM3wAAAAJ:LNjCCq68lIgC,1,https://scholar.google.com/scholar?oi=bibs&hl=en&cites=18295226917252589970,['18295226917252589970']
 High efficiency and low voltage pin top emitting organic light-emitting devices, 2005,5uiQM3wAAAAJ:MAUkC_7iAq8C,1,https://scholar.google.com/scholar?oi=bibs&hl=en&cites=3542772530073459111,['3542772530073459111']
 Organic pin homojunctions Fundamental properties and application in red phosphorescent OLED, 2005,5uiQM3wAAAAJ:z-B63o8J19IC,1,https://scholar.google.com/scholar?oi=bibs&hl=en&cites=1235414328969283061,['1235414328969283061']
 Soybean cultivar S010361, 2004,5uiQM3wAAAAJ:cxS_fjKIGZMC,1,https://scholar.google.com/scholar?oi=bibs&hl=en&cites=14495817450994377727,['14495817450994377727']
 Elektroaktive Hybridmaterialien auf der Basis von Metalloxidpartikeln und leitfähigen Polymerschichten, 2004,5uiQM3wAAAAJ:tgTmbKTkO1IC,1,https://scholar.google.com/scholar?oi=bibs&hl=en&cites=17947280070620835981,['17947280070620835981']
 Applied Physics Reviews, 2003,5uiQM3wAAAAJ:1xBWf43XMUgC,1,https://scholar.google.com/scholar?oi=bibs&hl=en&cites=2598184429536256472,['2598184429536256472']
 High-efficiency low-voltage stable inverted transparent electrophosphorescent organic light-emitting diodes combining electrically doped carrier transport layers and iridium …, 2003,5uiQM3wAAAAJ:3BvdIg-l-ZAC,1,https://scholar.google.com/scholar?oi=bibs&hl=en&cites=14773864570574945859,['14773864570574945859']
 Inverted OLEDs with Electrically Doped Carrier Injection and Transport Layers, 2002,5uiQM3wAAAAJ:sgsej9ZJWHMC,1,https://scholar.google.com/scholar?oi=bibs&hl=en&cites=11261480788461101101,['11261480788461101101']
" ""Surface states in molecular chains with strong mixing of Frenkel and charge-transfer excitons[Chemical Physics Letters 325 (2000) 308]"", pub_year 2001}",,5uiQM3wAAAAJ:3AIi9tQMIrsC,1,https://scholar.google.com/scholar?oi=bibs&hl=en&cites=16479559117351553428,['16479559117351553428']
 Field‐Induced Delocalization and Zener Breakdown in Semiconductor Superlattices, 2000,5uiQM3wAAAAJ:ubry08Y2EpUC,1,https://scholar.google.com/scholar?oi=bibs&hl=en&cites=2665151346615677006,['2665151346615677006']
 Bloch oscillations under influence of coherent plasmon coupling, 2000,5uiQM3wAAAAJ:QKtdBID3u5MC,1,https://scholar.google.com/scholar?oi=bibs&hl=en&cites=15575727725612859603,['15575727725612859603']
 The bond passivation model for carbon nanoparticle growth, 1998,5uiQM3wAAAAJ:NtGNdKbuCngC,1,https://scholar.google.com/scholar?oi=bibs&hl=en&cites=1658690068561893323,['1658690068561893323']
" Introduction to the Issue on Ultrafast Electronics, Photonics, and Optoelectronics", 1996,5uiQM3wAAAAJ:rbm3iO8VlycC,1,https://scholar.google.com/scholar?oi=bibs&hl=en&cites=6095355895295330854,['6095355895295330854']
 SUPERFAST MECHANISM OF VERTICAL DRIFT OF CURRENT CARRIERS IN MSM HETEROBARRIER STRUCTURES, 1995,5uiQM3wAAAAJ:DyXnQzXoVgIC,1,https://scholar.google.com/scholar?oi=bibs&hl=en&cites=10885323148350777823,['10885323148350777823']
 Time resolved luminescence spectroscopy of conjugated polymers, 1994,5uiQM3wAAAAJ:kw52XkFRtyQC,1,https://scholar.google.com/scholar?oi=bibs&hl=en&cites=783523068186847861,['783523068186847861']
 Heterobarrier photodiode MSM structures with subpicosecond temporal resolution, 1994,5uiQM3wAAAAJ:C33y2ycGS3YC,1,https://scholar.google.com/scholar?oi=bibs&hl=en&cites=18392002556487706981,['18392002556487706981']
 Optical properties of shallow In/sub 1-x/Ga/sub x/As/In/sub 1-y/Ga/sub y/As superlattices for optoelectronic applications, 1993,5uiQM3wAAAAJ:sA9dB-pw3HoC,1,https://scholar.google.com/scholar?oi=bibs&hl=en&cites=10295158660964605340,['10295158660964605340']
 Ultrafast carrier transfer in GaAs MSM-Diodes, 1993,5uiQM3wAAAAJ:QoJ_w57xiyAC,1,https://scholar.google.com/scholar?oi=bibs&hl=en&cites=2493551477130654939,['2493551477130654939']
 Ultrafast heterobarrier metal-semiconductor-metal photodetectors, 1993,5uiQM3wAAAAJ:R-LXmdHK_14C,1,https://scholar.google.com/scholar?oi=bibs&hl=en&cites=4918151271566805045,['4918151271566805045']
 Many-body semiclassical approximation for semiconductor plasmas, 1992,5uiQM3wAAAAJ:g8uWPOAv7ggC,1,https://scholar.google.com/scholar?oi=bibs&hl=en&cites=7443256260148060879,['7443256260148060879']
 Ultrafast carrier transport and capture in InGaAs/InP heterostructures, 1992,5uiQM3wAAAAJ:AYInfyleIOsC,1,https://scholar.google.com/scholar?oi=bibs&hl=en&cites=18112686532212084857,['18112686532212084857']
 Dependence of diffusion length on cooling rates and silicon bulk resistivity, 1985,5uiQM3wAAAAJ:EPG8bYD4jVwC,1,https://scholar.google.com/scholar?oi=bibs&hl=en&cites=1296996983924423210,['1296996983924423210']
" Narrowband organic photodetectors–towards miniaturized, spectroscopic sensing", 2022,5uiQM3wAAAAJ:npT69zEmqdIC,0,,
 Quasi-Self-Aligned Organic Thin-Film Transistors in Coplanar Top-Gate Configuration, 2021,5uiQM3wAAAAJ:Xxrp-jDxsD4C,0,,
 Control of Emission Characteristics of Perovskite Lasers through Optical Feedback, 2021,5uiQM3wAAAAJ:n2kG1_zAmykC,0,,
 Roadmap on organic–inorganic hybrid perovskite semiconductors and devices, 2021,5uiQM3wAAAAJ:LZ55yeyZZb4C,0,,
 Reduced Intrinsic Non‐Radiative Losses Allow Room‐Temperature Triplet Emission from Purely Organic Emitters, 2021,5uiQM3wAAAAJ:xXdmTUQ9lisC,0,,
 Reducing Non-Radiative Voltage Losses by Methylation of Push-Pull Molecular Donors in Organic Solar Cells., 2021,5uiQM3wAAAAJ:V8JMcbNWlSUC,0,,
 Band gap engineering in blended organic semiconductor films based on dielectric interactions, 2021,5uiQM3wAAAAJ:InLRhUNj-rwC,0,,
 One-dimensional planar topological laser, 2021,5uiQM3wAAAAJ:9mnZQYLiiboC,0,,
 Possible realization of directional optical waveguides in photonic crystals with broken time-reversal symmetry, 2021,5uiQM3wAAAAJ:zmHQPunddckC,0,,
 Optical Distance Measurement Based on Induced Nonlinear Photoresponse of High-Performance Organic Near-Infrared Photodetectors, 2021,5uiQM3wAAAAJ:5AT-p8ixKR4C,0,,
 Resonant Enhancement of Cavity Exciton–Polaritons via a Fano-Type Interaction in Organic Microcavities, 2021,5uiQM3wAAAAJ:DoBzxrgsGIIC,0,,
 Enhanced Charge Selectivity via Anodic-C60 Layer Reduces Nonradiative Losses in Organic Solar Cells, 2021,5uiQM3wAAAAJ:EVUe1p4rgj0C,0,,
 Defect‐State Lasing in Photonic Lattices of Metal–Organic Microcavities, 2021,5uiQM3wAAAAJ:SZzxPo9m4nkC,0,,
 Coherent optical interaction between plasmonic nanoparticles and small organic dye molecules in microcavities, 2021,5uiQM3wAAAAJ:vkDViGfkvYEC,0,,
 Enhanced Charge Selectivity via Anodic-C₆₀ Layer Reduces Nonradiative Losses in Organic Solar Cells, 2021,5uiQM3wAAAAJ:LpHykl0McycC,0,,
 Organic Complementary Inverters Based on Vertical-Channel Dual-Base Thin-Film Transistors with Time Constants< 10ns, 2020,5uiQM3wAAAAJ:54SpJiyHbzwC,0,,
 Organic solar cells From a lab curiosity to a serious photovoltaic technology, 2020,5uiQM3wAAAAJ:AOwgc6nnr1EC,0,,
 Highly crystalline organic light emitting diode for high current density operation, 2020,5uiQM3wAAAAJ:7xtfDMUJqJkC,0,,
 Electrochemical anodizing techniques for structuring of high-performance vertical organic field-effect transistors, 2020,5uiQM3wAAAAJ:YIdQ7BAI8VoC,0,,
 componente optoeletrônico em um substrato compreendendo um primeiro eletrodo e um segundo eletrodo, 2020,5uiQM3wAAAAJ:eP5N1itS6b0C,0,,
" Organic Power Electronics Transistor Operation in the kA/cm (2) Regime (vol 7, 44713, 2017)", 2020,5uiQM3wAAAAJ:-XtG2q47PdUC,0,,
 Author Correction Organic Power Electronics Transistor Operation in the kA/cm 2 Regime, 2020,5uiQM3wAAAAJ:fHS53ZCY-AEC,0,,
 Transparente elektrode für optoelektronische bauelemente, 2019,5uiQM3wAAAAJ:rsrKZ8bNWIsC,0,,
 Investigations on band structure engineering in organic semiconductors (Conference Presentation), 2019,5uiQM3wAAAAJ:esGtpfCv0y8C,0,,
" Electronic or optoelectronic device comprising an anchored thin molecular layer, process for its preparation and compound used therein", 2019,5uiQM3wAAAAJ:w5CyTnyFq80C,0,,
 Advisory Board Chairmen, 2019,5uiQM3wAAAAJ:4p3FJGzxjgAC,0,,
 Apparatus for spectrometrically capturing light with a photodiode which is monolithically integrated in the layer structure of a wavelength-selective filter, 2018,5uiQM3wAAAAJ:wH03y5nBhxsC,0,,
 Nanowire-based metamaterials electrodes for extremely fast charge collection, 2018,5uiQM3wAAAAJ:rQKKVauEoioC,0,,
 Vapor-deposited vertical organic field-effect transistors with optimized geometry for unrivaled transition frequencies (Conference Presentation), 2018,5uiQM3wAAAAJ:djcsc3XHdKAC,0,,
 High-sensitive near-infrared organic spectroscopic photodetectors for food quality sensing (Conference Presentation), 2018,5uiQM3wAAAAJ:wUCFpcnEedwC,0,,
 Investigations on electrical performance and contact resistance in solution-processed vertical organic field-effect transistors (Conference Presentation), 2018,5uiQM3wAAAAJ:rwEhk56xNqMC,0,,
 Coherent perfect absorption in one-port devices with wedged organic thin-film absorbers, 2018,5uiQM3wAAAAJ:u1IMlZnpNFQC,0,,
 Direction-selective interferometric optical filter, 2018,5uiQM3wAAAAJ:CmbFvBriOyMC,0,,
 Publisher Correction Elementary steps in electrical doping of organic semiconductors, 2018,5uiQM3wAAAAJ:tswL-GKFg8UC,0,,
 Nonequilibrium and equilibrium operation of organic disordered semiconductor devices (Conference Presentation), 2018,5uiQM3wAAAAJ:_u2aKJ9e-CoC,0,,
 Organic photodetectors and production method thereof, 2018,5uiQM3wAAAAJ:MtS25d97-7AC,0,,
 Accurate reconstruction of the jV-characteristic of organic solar cells from measurements of the external quantum efficiency, 2018,5uiQM3wAAAAJ:l7iSsH4_Im4C,0,,
 Near-infrared organic spectroscopic sensors for food quality sensing (Conference Presentation), 2018,5uiQM3wAAAAJ:k6nH7jlkaTkC,0,,
 Blue fluorescent emitters, 2018,5uiQM3wAAAAJ:P-MJmu9ZMwQC,0,,
 Organic narrowband NIR-detectors (Conference Presentation), 2017,5uiQM3wAAAAJ:lOG7zRu2uA8C,0,,
 Flexible Photovoltaics Microcavity‐Enhanced Semitransparent Electrodes for Oligothiophene Small‐Molecule Organic Solar Cells (Adv. Electron. Mater. 5/2017), 2017,5uiQM3wAAAAJ:MSzX15-gZgkC,0,,
 Novel hybrid laser modes in composite VCSEL-DFB microcavities (Conference Presentation), 2017,5uiQM3wAAAAJ:rp474-M6Y4oC,0,,
 Exploiting absorption-induced self-heating in solar cells (Conference Presentation), 2017,5uiQM3wAAAAJ:Sf6vrWCRp3YC,0,,
 Method for producing an organic component and organic component comprising an arrangement of isolated metal particle nanoclusters, 2017,5uiQM3wAAAAJ:DwFgw5hZUzMC,0,,
 Verfahren zur detektion und umwandlung von infraroter elektromagnetischer strahlung, 2017,5uiQM3wAAAAJ:aK62MiYD7mUC,0,,
 Novel Thin-Film Photovoltaics—Status and Perspectives, 2017,5uiQM3wAAAAJ:M7C5BM2v8n8C,0,,
 Elementary Processes in Organic Photovoltaics Preface, 2017,5uiQM3wAAAAJ:S0CDQJw8Yr4C,0,,
 Critical Dimensions in Small-Molecule Plasmonic Particle Solar Cells, 2017,5uiQM3wAAAAJ:Amrzk_ktLr0C,0,,
 Novel emission phenomena in organic microcavities (Conference Presentation), 2016,5uiQM3wAAAAJ:vkz5F8TaVKkC,0,,
 Lasing and macroscopic coherence of periodic 2D and 3D microstructures in organic microcavities (Conference Presentation), 2016,5uiQM3wAAAAJ:yaBp1wUtcLsC,0,,
 Organic permeable-base transistors-superb power efficiency at highest frequencies (Conference Presentation), 2016,5uiQM3wAAAAJ:SEKBqlyTJecC,0,,
 Near infrared aza-BODIPY donor materials for vacuum-processed bulk heterojunction solar cells, 2016,5uiQM3wAAAAJ:2mikiJ1VBVsC,0,,
 Hybrid Resonators Lasing and Macroscopic Coherence of Hybridized Modes in Coupled 2D Waveguide‐VCSEL Resonators (Advanced Optical Materials 8/2016), 2016,5uiQM3wAAAAJ:V63Ir2N1OTwC,0,,
 Modeling of fully printed organic field effect transistors for circuit design and simulation, 2016,5uiQM3wAAAAJ:fGk8ZXjgAbkC,0,,
 Small Molecule Organic Solar Cells, 2016,5uiQM3wAAAAJ:RmcNAhKkducC,0,,
" Organic zener diode, electronic circuit, and method for operating an organic zener diode", 2016,5uiQM3wAAAAJ:wlzmIqt2EaEC,0,,
 Doped Organic Transistors, 2016,5uiQM3wAAAAJ:1Lk_dUza_R0C,0,,
 Transistors Advanced Organic Permeable‐Base Transistor with Superior Performance (Adv. Mater. 47/2015), 2015,5uiQM3wAAAAJ:8rLWgkbgOXQC,0,,
 Polymer-facilitated low temperature fusing of spray-coated silver nanowire networks as transparent top and bottom electrodes in small molecule organic photovoltaics …, 2015,5uiQM3wAAAAJ:qYOp8iumCsAC,0,,
 Exciton binding energy limitations in organic materials and potentials for improvements (Presentation Recording), 2015,5uiQM3wAAAAJ:qhW0HyKmSusC,0,,
 A solution-doped small molecule hole transport layer for efficient ITO-free organic solar cells (Presentation Recording), 2015,5uiQM3wAAAAJ:xlVdBZVQT58C,0,,
 Paper No P16 Efficient ITO‐Free Organic Light‐Emitting Diodes Based on Highly Conductive Polymer Electrodes, 2015,5uiQM3wAAAAJ:bkKuixW_xMkC,0,,
 Ambipolar organic permeable base transistors, 2015,5uiQM3wAAAAJ:JTtNqH-x4gYC,0,,
 Organic memory element, 2015,5uiQM3wAAAAJ:ji7lAbPyDbYC,0,,
 Photonic lattices in organic microcavities, 2015,5uiQM3wAAAAJ:cpgjJtNNFA0C,0,,
 OLEDs, 2015,5uiQM3wAAAAJ:_cFkbNEifk0C,0,,
 Том. 9566. Organic Light Emitting Materials and Devices XIX.-Сер. Organic Light Emitting Materials and Devices XIX, 2015,5uiQM3wAAAAJ:-Z8x4v2cOtkC,0,,
 Plasmonic and Photonic Crystals, 2015,5uiQM3wAAAAJ:CMPXdcK5v8EC,0,,
 Triplet Harvesting in White Organic Light-Emitting Diodes, 2014,5uiQM3wAAAAJ:J4E9jCG1tHUC,0,,
 Organic Solar Cells From a Lab Curiosity to a Serious Photovoltaic Technology (Presentation Video), 2014,5uiQM3wAAAAJ:JqN3CTdJtl0C,0,,
 Transparent Electrodes for Organic Photovoltaics and OLEDs, 2014,5uiQM3wAAAAJ:qCaWouos7ogC,0,,
 Organic Field Effect Transistor and Method for Production, 2014,5uiQM3wAAAAJ:8JTMrWI6FdcC,0,,
 Transparente elektrode für optoelektronische bauelemente, 2014,5uiQM3wAAAAJ:9w-KRoa3VEQC,0,,
